Unnamed: 0,Case Number,Project Names,Amount,Date,Beneficiaries,Beneficiary type,Number of donations,Partner,Location,Details URL,Hijri_Month
693,P48317,تفريج كرب الأسر المتعففة,150000,2024-05-29,270,المواطنون,11402,جمعية البر الخيرية بضبيعة,ضبيعة,https://ehsan.sa/projects/0/47318?amount=null,ذو القعدة
694,P47123,الرعاية الصحية لمرضى الأسنان,120000,2024-05-28,8,المواطنون والمقيمون بالمملكة,12065,جمعية ابتسم لخدمات طب الاسنان,القنفذه,https://ehsan.sa/projects/0/46124?amount=null,ذو القعدة
695,P48294,دعم المقبلين على الزواج,315000,2024-05-28,45,المواطنون,21718,جمعية التنمية الأسرية بمحافظة رفحاء (ملاذ),رفحاء,https://ehsan.sa/projects/0/47295?amount=null,ذو القعدة
696,P48322,سقيا الماء,300000,2024-05-28,300000,المواطنون والمقيمون بالمملكة,21033,جمعية حفظ النعمة بمنطقة مكة المكرمة,جدة,https://ehsan.sa/projects/0/47323?amount=null,ذو القعدة
697,P48319,طباعة المصحف الشريف باللغة البرتغالية,24000,2024-05-27,1000,المواطنون والمقيمون بالمملكة,1224,مجمع الملك فهد لطباعة المصحف الشريف بالمدينة المنورة,المدينة المنورة,https://ehsan.sa/projects/0/47320?amount=null,ذو القعدة
698,P48313,تفريج كرب المتعففين,300000,2024-05-27,60,المواطنون,16296,جمعية البر الخيرية بوادي يبه القوز,القوز,https://ehsan.sa/projects/0/47314?amount=null,ذو القعدة
699,P48311,سقيا الماء,480000,2024-05-27,506,المواطنون,39948,الجمعية الخيرية بوادي قديد,خليص,https://ehsan.sa/projects/0/47312?amount=null,ذو القعدة
700,P48298,توفير الأدوية للمرضى المحتاجين,500000,2024-05-27,490,المواطنون والمقيمون بالمملكة,31283,جمعية عناية الصحية,الرياض,https://ehsan.sa/projects/0/47299?amount=null,ذو القعدة
701,P48310,كفالة الحجاج,402390,2024-05-26,35,المواطنون والمقيمون بالمملكة,24983,جمعية الهدى لمساعدة الحجاج بمحافظة رابغ,مكة المكرمة,https://ehsan.sa/projects/0/47311?amount=null,ذو القعدة
702,P48307,وجبات الطعام للحجاج,350000,2024-05-26,50000,المواطنون والمقيمون بالمملكة,27046,جمعية ضيافة المدينة المنورة لخدمة الحجاج والمعتمرين,المدينة المنورة,https://ehsan.sa/projects/0/47308?amount=null,ذو القعدة
703,P48308,سقيا الماء لضيوف الرحمن,500000,2024-05-24,400000,المواطنون والمقيمون بالمملكة,38010,جمعية عائل للرعاية الأسرية بمحافظة تربة,مكة المكرمة,https://ehsan.sa/projects/0/47309?amount=null,ذو القعدة
704,P48303,كسوة الأسر المتعففة,293000,2024-05-24,586,المواطنون,23932,جمعية ذات النطاقين النسائية الخيرية بمحايل عسير,محايل عسير,https://ehsan.sa/projects/0/47304?amount=null,ذو القعدة
705,P48288,توفير اللحوم للأسر المتعففة,192000,2024-05-24,120,المواطنون,13301,جمعية البر الخيرية بمغينية,رابغ,https://ehsan.sa/projects/0/47289?amount=null,ذو القعدة
706,P48306,كفالة الحُجّاج,396337,2024-05-24,39,المواطنون والمقيمون بالمملكة,25249,جمعية حفاوة لخدمة الحاج والمعتمر والزائر,مكة المكرمة,https://ehsan.sa/projects/0/47307?amount=null,ذو القعدة
707,P48272,سداد إيجار منازل الأسر المتعففة,247000,2024-05-24,19,المواطنون والمقيمون بالمملكة,14725,جمعية الحلول التنموية للإسكان,الحليله,https://ehsan.sa/projects/0/47273?amount=null,ذو القعدة
708,P48225,زراعة الأشجار لمكافحة التصحر,155000,2024-05-23,30000,المواطنون والمقيمون بالمملكة,18075,جمعية التنمية الأهلية بالجنينة,بيشة,https://ehsan.sa/projects/0/47226?amount=null,ذو القعدة
709,P48270,ترجمة معاني القرآن الكريم إلى الألمانية,120000,2024-05-23,3000,المواطنون والمقيمون بالمملكة,10738,مجمع الملك فهد لطباعة المصحف الشريف بالمدينة المنورة,المدينة المنورة,https://ehsan.sa/projects/0/47271?amount=null,ذو القعدة
710,P48305,سقيا الماء,546000,2024-05-23,350,المواطنون,53397,جمعية البر الخيرية بالغريف,الكامل,https://ehsan.sa/projects/0/47306?amount=null,ذو القعدة
711,P48289,تأمين أجهزة القوقعة للمتعففين,220000,2024-05-22,4,المواطنون,12062,الجمعية الصحية التطوعية في الزلفي,الزلفي,https://ehsan.sa/projects/0/47290?amount=null,ذو القعدة
712,P48295,كفالة أمهات الأيتام,182400,2024-05-21,38,المواطنون,8737,جمعية عثمان بن عفان الخيرية بالحفائر,خميس  مشيط,https://ehsan.sa/projects/0/47296?amount=null,ذو القعدة
713,P48302,كفالة الحُجّاج,279774,2024-05-20,54,المواطنون والمقيمون بالمملكة,19696,جمعية الدعوة والارشاد وتوعية الجاليات في مركز البجادية,البجادية,https://ehsan.sa/projects/0/47303?amount=null,ذو القعدة
714,P48263,الرعاية الصحية لمرضى الفشل الكلوي,399400,2024-05-20,50,المواطنون والمقيمون بالمملكة,19923,جمعية أطباء طيبة الطبية الخيرية حياة,المدينة المنورة,https://ehsan.sa/projects/0/47264?amount=null,ذو القعدة
715,P48293,إعانة أسر السجناء,80000,2024-05-20,5,المواطنون والمقيمون بالمملكة,5244,جمعية مساعدة السجناء المعسرين والمعوزين بجدة,جدة,https://ehsan.sa/projects/0/47294?amount=null,ذو القعدة
716,P48292,تفريج كرب المتعففين,260000,2024-05-19,130,المواطنون,17563,جمعية عثمان بن عفان الخيرية بالحفائر,خميس  مشيط,https://ehsan.sa/projects/0/47293?amount=null,ذو القعدة
717,P48296,رعاية كبار السن المتعففين,180000,2024-05-19,120,المواطنون,15706,جمعية البر الخيرية بالهمجة,النبهانية,https://ehsan.sa/projects/0/47297?amount=null,ذو القعدة
718,P48301,سقيا الماء لضيوف الرحمن,600000,2024-05-19,1090909,المواطنون والمقيمون بالمملكة,49686,جمعية رفادة لخدمة الحاج والمعتمر,مكة المكرمة,https://ehsan.sa/projects/0/47302?amount=null,ذو القعدة
719,P48297,كفالة الحجاج,399900,2024-05-18,43,المواطنون,21842,جمعية البر الخيرية للخدمات الاجتماعية بمحافظة يدمة,يدمة,https://ehsan.sa/projects/0/47298?amount=null,ذو القعدة
720,P48275,دعم حلقات تحفيظ القرآن الكريم,300000,2024-05-17,309,المواطنون والمقيمون بالمملكة,25637,جمعية تحفيظ القرآن الكريم بالرياض مكنون,الرياض,https://ehsan.sa/projects/0/47276?amount=null,ذو القعدة
721,P48291,وجبات الطعام للأسر المتعففة,92400,2024-05-17,4620,المواطنون والمقيمون بالمملكة,6946,جمعية حفظ النعمة الخيرية بالبدائع,البدائع,https://ehsan.sa/projects/0/47292?amount=null,ذو القعدة
722,P48284,سقيا الماء للأسر المتعففة,541800,2024-05-17,1204,المواطنون,51625,جمعية البر الخيرية بمركز غميقة,الليث,https://ehsan.sa/projects/0/47285?amount=null,ذو القعدة
723,P48283,كفالة الحجاج,632500,2024-05-17,55,المواطنون والمقيمون بالمملكة,42945,جمعية سعادتي الاجتماعية,الرياض,https://ehsan.sa/projects/0/47284?amount=null,ذو القعدة
724,P48255,السلال الغذائية للأسر المحتاجة,268500,2024-05-16,537,المواطنون,18325,جمعية البر الخيرية بربوع العين,أضم,https://ehsan.sa/projects/0/47256?amount=null,ذو القعدة
725,P48267,تفريج كرب الأسر المتعففة,100000,2024-05-15,20,المواطنون,6923,جمعية أصدقاء لاعبي كرة القدم الخيرية,الرياض,https://ehsan.sa/projects/0/47268?amount=null,ذو القعدة
726,P48276,وجبات الطعام للأسر المتعففة,220000,2024-05-15,44000,المواطنون والمقيمون بالمملكة,17255,جمعية خيرات لحفظ النعمة,الرياض,https://ehsan.sa/projects/0/47283?amount=null,ذو القعدة
727,P48269,التكفل بالعمرة للمتعففين,45000,2024-05-14,150,المواطنون والمقيمون بالمملكة,3904,جمعية الدعوة والإرشاد بقرى الحسيني والنجوع,صبياء,https://ehsan.sa/projects/0/47270?amount=null,ذو القعدة
728,P48256,دعم المقبلين على الزواج,250000,2024-05-14,50,المواطنون,18554,الجمعية الخيرية لمساعدة الشباب على الزواج والتوجيه الأسري بجدة,جدة,https://ehsan.sa/projects/0/47257?amount=null,ذو القعدة
729,P48273,سقيا الماء,500000,2024-05-13,500000,المواطنون والمقيمون بالمملكة,48066,جمعية الغريف بمحافظة الخرمة,النزهة - مكة المكرمة,https://ehsan.sa/projects/0/47274?amount=null,ذو القعدة
730,P48244,الأجهزة الطبية للمتعففين,150000,2024-05-13,67,المواطنون والمقيمون بالمملكة,9023,اكرام المسنين بمنطقة مكة المكرمة,جدة,https://ehsan.sa/projects/0/47245?amount=null,ذو القعدة
731,P48274,الكفالة التعليمية للطلاب المتعففين,36000,2024-05-13,25,المواطنون,1746,جمعية التنمية الاهلية بالعماير,الأمواه,https://ehsan.sa/projects/0/47275?amount=null,ذو القعدة
732,P48271,عملية جراحية لمريض هشاشة عظام,26400,2024-05-12,1,المقيمون بالمملكة,1632,جمعية رحماء الصحية,الرياض,https://ehsan.sa/projects/0/47272?amount=null,ذو القعدة
733,P48242,رعاية كبار السن المتعففين,268000,2024-05-12,67,المواطنون,18060,جمعية أكابر لكبار السن بمنطقة عسير,أبها,https://ehsan.sa/projects/0/47243?amount=null,ذو القعدة
734,P47907,توفير الأجهزة الكهربائية للمحتاجين,199992,2024-05-12,39,المواطنون,17753,جمعية مساند لتمكين ذوي الظروف الخاصة بمكة المكرمة,مكة المكرمة,https://ehsan.sa/projects/0/46908?amount=null,ذو القعدة
735,P48261,كفالة رواتب معلمي ومعلمات حلقات تحفيظ القرآن الكريم,200000,2024-05-11,100,المواطنون,19107,الجمعية تحفيظ القرآن الكريم بالجموم,الجموم,https://ehsan.sa/projects/0/47262?amount=null,ذو القعدة
736,P48266,تيسير نقل المرضى المتعففين,156000,2024-05-11,8,المواطنون والمقيمون بالمملكة,16640,جمعية الخدمات الطبية الاسعافية,الرياض,https://ehsan.sa/projects/0/47267?amount=null,ذو القعدة
737,P48265,سداد إيجار منازل الأسر المتعففة,336400,2024-05-11,102,المواطنون والمقيمون بالمملكة,21314,جمعية الإحسان للخدمات الاجتماعية,بريدة,https://ehsan.sa/projects/0/47266?amount=null,ذو القعدة
738,P48257,كفالة الأرامل والمطلقات,250000,2024-05-11,50,المواطنون,17158,جمعية عطاء بمحافظة جده,جدة,https://ehsan.sa/projects/0/47258?amount=null,ذو القعدة
739,P48246,جلسات العلاج التأهيلي للمتعففين,300000,2024-05-10,24,المواطنون والمقيمون بالمملكة,22592,جمعية إيفاء لرعاية ذوي الإعاقة,الدمام,https://ehsan.sa/projects/0/47247?amount=null,ذو القعدة
740,P48245,توفير الإنسولين لمرضى السكري,300000,2024-05-10,200,المواطنون والمقيمون بالمملكة,20538,جمعية اصدقاء مرضى السكر الخيرية,جدة,https://ehsan.sa/projects/0/47246?amount=null,ذو القعدة
741,P48203,وجبات الطعام للطلاب الجامعيين,195000,2024-05-10,15000,المقيمون بالمملكة,19286,جمعية ارزاق الخير لحفظ النعمة,حفر الباطن,https://ehsan.sa/projects/0/47204?amount=null,ذو القعدة
742,P48264,كفالة مغسلي الجنائز,74400,2024-05-10,3,المواطنون والمقيمون بالمملكة,6921,جمعية الإحسان لشؤون الموتى بمحافظة وادي الدواسر,وادى الدواسر,https://ehsan.sa/projects/0/47265?amount=null,ذو القعدة
743,P48252,سقيا الماء للأسر المتعففة,300000,2024-05-10,810,المواطنون,27264,جمعية التنمية الأهلية بالشداخة,بيشة,https://ehsan.sa/projects/0/47253?amount=null,ذو القعدة
744,P48262,جلسات كيماوي عاجلة لمريضة متعففة,43813,2024-05-09,1,المواطنون والمقيمون بالمملكة,2456,جمعية الإحسان الطبية الخيرية,جازان,https://ehsan.sa/projects/0/47263?amount=null,ذو القعدة
745,P48258,رحلات العمرة للمتعففين,99000,2024-05-09,800,المواطنون والمقيمون بالمملكة,9857,جمعية الدعوة والإرشاد وتوعية الجاليات بالمحاني,الطائف,https://ehsan.sa/projects/0/47259?amount=null,ذو القعدة
746,P48259,ترجمة معاني القرآن الكريم إلى الكورية,76000,2024-05-09,1000,المواطنون والمقيمون بالمملكة,7862,مجمع الملك فهد لطباعة المصحف الشريف بالمدينة المنورة,المدينة المنورة,https://ehsan.sa/projects/0/47260?amount=null,ذو القعدة
747,P48254,تفريج كرب الأسر المتعففة,270000,2024-05-08,108,المواطنون,15656,جمعية البر الخيرية بمحافظة قرية العليا,قرية العليا,https://ehsan.sa/projects/0/47255?amount=null,شوال
748,P48260,عملية جراحية لمصابة بكسر في الترقوة,23920,2024-05-07,1,المقيمون بالمملكة,1695,جمعية رحماء الصحية,الرياض,https://ehsan.sa/projects/0/47261?amount=null,شوال
749,P48231,سداد إيجار الأسر المتعففة,300000,2024-05-07,25,المواطنون,13278,جمعية البر الخيرية بثلوث المنظر,ثلوث المنظر,https://ehsan.sa/projects/0/47232?amount=null,شوال
750,P48233,السلال الغذائية للأسر المحتاجة,213500,2024-05-06,610,المواطنون,14151,جمعية البر الخيرية بمركز فيضة اثقب,حائل,https://ehsan.sa/projects/0/47234?amount=null,شوال
751,P48237,التكفل بالعمرة للمعاقين من الجاليات,250000,2024-05-06,50,المقيمون بالمملكة,21006,جمعية حفاوة لخدمة الحاج والمعتمر والزائر,مكة المكرمة,https://ehsan.sa/projects/0/47238?amount=null,شوال
752,P48241,كفالة الأرامل والمطلقات,78000,2024-05-05,48,المواطنون,4391,جمعية مركز الحماده,فيضة الحماده,https://ehsan.sa/projects/0/47242?amount=null,شوال
753,P48243,طباعة المصحف الشريف باللغة التركية,100000,2024-05-05,4000,المواطنون والمقيمون بالمملكة,10030,مجمع الملك فهد لطباعة المصحف الشريف بالمدينة المنورة,المدينة المنورة,https://ehsan.sa/projects/0/47244?amount=null,شوال
754,P47826,الكفالة التعليمية للطلاب المحتاجين,200000,2024-05-05,100,المواطنون,17437,جمعية فتاة الاحساء التنموية الخيرية,الأحساء,https://ehsan.sa/projects/0/46827?amount=null,شوال
755,P48240,دعم المقبلين على الزواج,160000,2024-05-04,16,المواطنون,7790,جمعية التنمية الأسرية في محافظة الأفلاج,الأفلاج,https://ehsan.sa/projects/0/47241?amount=null,شوال
756,P48248,سقيا الماء لضيوف الرحمن,500000,2024-05-04,500000,المواطنون والمقيمون بالمملكة,43081,الجمعية الخيرية بمحافظة الكامل,مكة المكرمة,https://ehsan.sa/projects/0/47249?amount=null,شوال
757,P48239,تأثيث منازل المتعففين,250000,2024-05-04,79,المواطنون,21066,جمعية البر الخيرية بأم الدوم,المويه,https://ehsan.sa/projects/0/47240?amount=null,شوال
758,P48247,علاج تأخر النمو لطفلة,30000,2024-05-03,1,المقيمون بالمملكة,1579,جمعية الكوثر الصحية بعسير,أبها,https://ehsan.sa/projects/0/47248?amount=null,شوال
759,P48235,تفريج كرب الأسر المتعففة,301500,2024-05-03,201,المواطنون,16844,جمعية البر الخيرية بمركز شثاث,الشبحة,https://ehsan.sa/projects/0/47236?amount=null,شوال
760,P48236,كفالة الأرامل والمطلقات,246000,2024-05-03,41,المواطنون,12976,جمعية البر الخيرية بمركز غامد الزناد بمنطقة الباحة,غامد الزناد,https://ehsan.sa/projects/0/47237?amount=null,شوال
761,P48238,طباعة المصاحف,400000,2024-05-03,10000,المواطنون والمقيمون بالمملكة,34791,مجمع الملك فهد لطباعة المصحف الشريف بالمدينة المنورة,المدينة المنورة,https://ehsan.sa/projects/0/47239?amount=null,شوال
762,P48232,علاج حرق من الدرجة الثالثة لمريض متعفف,84223,2024-05-02,1,المقيمون بالمملكة,4030,جمعية رحماء الصحية,الرياض,https://ehsan.sa/projects/0/47233?amount=null,شوال
763,P47831,الأجهزة الطبية للمتعففين,100000,2024-05-02,50,المواطنون والمقيمون بالمملكة,5027,جمعية بسمة معافى الصحية,حفر الباطن,https://ehsan.sa/projects/0/46832?amount=null,شوال
764,P48234,سقيا الماء,246000,2024-05-01,205,المواطنون,16567,جمعية البر والخدمات الاجتماعية بأرن,ارن,https://ehsan.sa/projects/0/47235?amount=null,شوال
765,P47624,الكفالة التعليمية للأيتام,10010,2024-04-30,7,المواطنون,527,الجمعية الخيرية لرعاية الايتام بتبوك,تبوك,https://ehsan.sa/projects/0/46625?amount=null,شوال
766,P48222,كفالة الأرامل المتعففات,398400,2024-04-30,166,المواطنون,19575,الجمعية الخيرية لرعاية الأيتام بالمنطقة الشرقية بناء,الخبر,https://ehsan.sa/projects/0/47225?amount=null,شوال
767,P48213,استكمال بناء مسجد جازان,2405322,2024-04-30,300,المواطنون والمقيمون بالمملكة,150783,جمعية كفاءة للتشغيل والصيانة الأهلية,بلغازي,https://ehsan.sa/projects/0/47214?amount=null,شوال
768,P47855,توفير الأجهزة الكهربائية للمحتاجين,195000,2024-04-30,195,المواطنون,19611,جمعية الملك خالد الخيرية النسائية بتبوك,تبوك,https://ehsan.sa/projects/0/46856?amount=null,شوال
769,P48228,العلاج الكيميائي للأطفال المصابين بالسرطان,499062,2024-04-30,4,المقيمون بالمملكة,23112,بصمة تفاؤل لمرضى سرطان الاطفال,الرياض,https://ehsan.sa/projects/0/47229?amount=null,شوال
770,P48227,الجلسات التأهيلية لذوي الإعاقة,300000,2024-04-29,20,المواطنون,20474,جمعية التوحد في محافظة رجال ألمع,رجال ألمع,https://ehsan.sa/projects/0/47228?amount=null,شوال
771,P47823,الكفالة التعليمية للطلاب المحتاجين,177120,2024-04-29,123,المواطنون,13712,جمعية البر الخيرية بالأبواء,الأبواء,https://ehsan.sa/projects/0/46824?amount=null,شوال
772,P48200,تأثيث مساكن اليتيمات,494400,2024-04-29,12,المواطنون,37398,جمعية بنيان للخدمات الاجتماعية,بريدة,https://ehsan.sa/projects/0/47201?amount=null,شوال
773,P48221,السلال الغذائية للأسر المحتاجة,158400,2024-04-28,198,المواطنون والمقيمون بالمملكة,9816,جمعية البر بمركز سلطانة,سلطانة,https://ehsan.sa/projects/0/47222?amount=null,شوال
774,P48215,دعم المقبلين على الزواج,450000,2024-04-27,90,المواطنون,31091,جمعية التنمية الأسرية بالمنطقة الشرقية وئام,الدمام,https://ehsan.sa/projects/0/47216?amount=null,شوال
775,P48230,توفير المصاحف للمكفوفين,280000,2024-04-27,35,المواطنون,22624,جمعية المكفوفين الأهلية بمنطقة الرياض كفيف,الرياض,https://ehsan.sa/projects/0/47231?amount=null,شوال
776,P48217,رعاية كبار السن المتعففين,180000,2024-04-26,30,المواطنون,9637,الجمعية السعودية لمساندة كبار السن وقار,الرياض,https://ehsan.sa/projects/0/47218?amount=null,شوال
777,P48226,التكفل بالعمرة للمتعففين,40000,2024-04-26,67,المواطنون,3434,الجمعية النسائية بحفر الباطن (درة),حفر الباطن,https://ehsan.sa/projects/0/47227?amount=null,شوال
778,P48204,سداد إيجار منازل الأسر المتعففة,400600,2024-04-26,14,المواطنون,23936,جمعية أصدقاء لاعبي كرة القدم الخيرية,الرياض,https://ehsan.sa/projects/0/47205?amount=null,شوال
779,P47873,سقيا الماء,102000,2024-04-26,680,المواطنون والمقيمون بالمملكة,8625,جمعية الشماس للخدمات الاجتماعية عطاء ببريده,بريدة,https://ehsan.sa/projects/0/46874?amount=null,شوال
780,P48229,الفحوصات الطبية لمريضة مصابة بورم في الثدي,51051,2024-04-25,1,المقيمون بالمملكة,2903,جمعية رحماء الصحية,الرياض,https://ehsan.sa/projects/0/47230?amount=null,شوال
781,P47828,الأجهزة الطبية للمتعففين,60000,2024-04-25,60,المواطنون والمقيمون بالمملكة,4151,جمعية مراس الصحية,أبها,https://ehsan.sa/projects/0/46829?amount=null,شوال
782,P47833,توفير الأدوية للمرضى المحتاجين,127500,2024-04-25,50,المقيمون بالمملكة,8592,جمعية رحماء الصحية,الرياض,https://ehsan.sa/projects/0/46834?amount=null,شوال
783,P48220,كفالة الأرامل والمطلقات,184000,2024-04-25,184,المواطنون,9890,جمعية البر والخدمات الاجتماعية بسبت العلاية,بلقرن,https://ehsan.sa/projects/0/47221?amount=null,شوال
784,P48150,طباعة ونشر المصاحف,2250000,2024-04-25,150000,المواطنون والمقيمون بالمملكة,149597,مجمع الملك فهد لطباعة المصحف الشريف بالمدينة المنورة,المدينة المنورة,https://ehsan.sa/projects/0/47155?amount=null,شوال
785,P48216,رحلات العمرة للمتعففين,100000,2024-04-25,200,المواطنون والمقيمون بالمملكة,10470,جمعية الدعوة والإرشاد وتوعية الجاليات ببني حسن,بني حسن,https://ehsan.sa/projects/0/47217?amount=null,شوال
786,P47866,سقيا الماء للأسر المتعففة,50000,2024-04-24,100,المواطنون,4562,جمعية التنمية الاجتماعية بالغالة,الغالة,https://ehsan.sa/projects/0/46867?amount=null,شوال
787,P47821,الكفالة التعليمية للطلاب,172800,2024-04-24,120,المواطنون,11112,جمعية أيتام الجبيل,الجبيل,https://ehsan.sa/projects/0/46822?amount=null,شوال
788,P47836,الرعاية الصحية لمرضى السرطان,170000,2024-04-24,17,المقيمون بالمملكة,7209,جمعية براءة لأمراض دم وسرطان الاطفال بمكة,مكة المكرمة,https://ehsan.sa/projects/0/46837?amount=null,شوال
789,P48219,السلال الغذائية للأسر المحتاجة,161000,2024-04-24,322,المواطنون,12110,جمعية البر الخيرية بالحفير,الحفير,https://ehsan.sa/projects/0/47220?amount=null,شوال
790,P47847,سقيا الماء,33600,2024-04-23,1200,المواطنون,2405,جمعية البر الخيرية بالحقو,الحقو,https://ehsan.sa/projects/0/46848?amount=null,شوال
