Unnamed: 0,Case Number,Project Names,Amount,Date,Beneficiaries,Beneficiary type,Number of donations,Partner,Location,Details URL,Hijri_Month
997,P47862,عمليات العيون الجراحية للأطفال,385000,2024-04-01,35,المواطنون والمقيمون بالمملكة,12981,جمعية ابصار الخيرية لتأهيل وخدمة ذوي الاعاقة البصرية,جدة,https://ehsan.sa/projects/0/46863?amount=null,رمضان
998,P48024,إفطار الصائمين,300000,2024-04-01,30000,المواطنون والمقيمون بالمملكة,16957,جمعية البر الخيرية بأبها,أبها,https://ehsan.sa/projects/0/47025?amount=null,رمضان
999,P48026,كفالة الأرامل والمطلقات,291000,2024-04-01,291,المواطنون,7402,جمعية فتاة ثقيف الخيرية النسائية بالطائف,الطائف,https://ehsan.sa/projects/0/47027?amount=null,رمضان
1000,P47999,دعم الأسر النازحة,180000,2024-04-01,60,المواطنون,3201,جمعية البر الخيرية بالنماص,النماص,https://ehsan.sa/projects/0/47000?amount=null,رمضان
1001,P48027,رحلات العمرة للمحتاجين,60000,2024-04-01,400,المقيمون بالمملكة,4699,جمعية الدعوة والإرشاد وتوعية الجاليات بالراكة,الخبر,https://ehsan.sa/projects/0/47028?amount=null,رمضان
1002,P48025,توفير وجبات السحور للمحتاجين,214500,2024-04-01,19500,المواطنون والمقيمون بالمملكة,19881,جمعية الدعوة والإرشاد وتوعية الجاليات بوسط بيشة,بيشة,https://ehsan.sa/projects/0/47026?amount=null,رمضان
1003,P47998,سقيا الماء,600000,2024-04-01,600000,المواطنون والمقيمون بالمملكة,43661,جمعية سبل للخدمات الإنسانية,مكة المكرمة,https://ehsan.sa/projects/0/46999?amount=null,رمضان
1004,P47976,جلسات العلاج الطبيعي لذوي الإعاقة,249980,2024-04-01,29,المواطنون والمقيمون بالمملكة,20105,جمعية التأهيل والعلاج الطبيعي,المدينة المنورة,https://ehsan.sa/projects/0/46977?amount=null,رمضان
1005,P48001,كسوة العيد,194400,2024-04-01,162,المواطنون,14885,جمعية روافد الخيرية النسائية,العيص,https://ehsan.sa/projects/0/47002?amount=null,رمضان
1006,P48029,التكفل بالعمرة للجاليات,70000,2024-03-31,350,المواطنون والمقيمون بالمملكة,4402,جمعية الدعوة والارشاد وتوعية الجاليات بهجرة ابن شريم,ابن شريم,https://ehsan.sa/projects/0/47030?amount=null,رمضان
1007,P48022,تفريج كرب الأسر المحتاجة,300600,2024-03-31,167,المواطنون,13406,جمعية البر بقرى الفحو,أضم,https://ehsan.sa/projects/0/47023?amount=null,رمضان
1008,P47985,كفالة حلقات تحفيظ القرآن الكريم,200000,2024-03-31,800,المواطنون والمقيمون بالمملكة,11605,الجمعية  الخيرية لتحفيظ القرآن الكريم بعشيرة,مكة المكرمة,https://ehsan.sa/projects/0/46986?amount=null,رمضان
1009,P47695,تأثيث منازل المحتاجين,322400,2024-03-31,62,المواطنون,20657,جمعية البر الخيرية بمركز الجائزة,الجائزة,https://ehsan.sa/projects/0/46696?amount=null,رمضان
1010,P48033,قسطرة قلب لمريضة متعففة,18454,2024-03-31,1,المقيمون بالمملكة,937,جمعية الإحسان الطبية الخيرية,جازان,https://ehsan.sa/projects/0/47034?amount=null,رمضان
1011,P47996,وجبات إفطار الصائمين,225000,2024-03-31,750,المواطنون,11706,جمعية أصدقاء العمل التطوعي بالجوف (يمناكم),سكاكا,https://ehsan.sa/projects/0/46997?amount=null,رمضان
1012,P48002,كفالة الأرامل والمطلقات,280000,2024-03-31,350,المواطنون,6526,الجمعية الخيرية بأبي عريش,أبي عريش,https://ehsan.sa/projects/0/47003?amount=null,رمضان
1013,P48004,رحلات العمرة للمحتاجين,50625,2024-03-31,45,المواطنون,3738,جمعية إجلال لمساندة كبار السن بالأفلاج,الأفلاج,https://ehsan.sa/projects/0/47005?amount=null,رمضان
1014,P48005,رحلات العمرة للمحتاجين,240000,2024-03-31,960,المواطنون والمقيمون بالمملكة,18591,جمعية الدعوة والإرشاد بمحافظة الدلم,الدلم,https://ehsan.sa/projects/0/47006?amount=null,رمضان
1015,P48010,سداد إيجار منازل الأسر المتعففة,261000,2024-03-31,58,المواطنون والمقيمون بالمملكة,6465,الجمعية السعودية الخيرية للفصام ( احتواء),الرياض,https://ehsan.sa/projects/0/47011?amount=null,رمضان
1016,P48008,العمليات الجراحية للمحتاجين,200000,2024-03-31,40,المواطنون والمقيمون بالمملكة,9381,جمعية مراس الصحية,أبها,https://ehsan.sa/projects/0/47009?amount=null,رمضان
1017,P48012,سحور الصائمين في الحرم,450000,2024-03-31,30000,المواطنون والمقيمون بالمملكة,34730,جمعية عائل للرعاية الأسرية بمحافظة تربة,مكة المكرمة,https://ehsan.sa/projects/0/47013?amount=null,رمضان
1018,P47770,إعانة أسر السجناء,300070,2024-03-31,74,المواطنون,14611,جمعية ايأدي الأمل للتوعية بأضرار المخدرات ورعاية المتعافين,محايل عسير,https://ehsan.sa/projects/0/46771?amount=null,رمضان
1019,P48014,وجبات الإفطار في ساحات الحرم المكي,390000,2024-03-31,30000,المواطنون والمقيمون بالمملكة,24545,الجمعية الخيرية ببحرة (يسر),مكة المكرمة,https://ehsan.sa/projects/0/47017?amount=null,رمضان
1020,P47671,البرامج التأهيلية للمتعافين من الإدمان,120000,2024-03-31,100,المواطنون,7991,جمعية واثق,تبوك,https://ehsan.sa/projects/0/46672?amount=null,رمضان
1021,P48017,عملية قلب مفتوح لمريض متعفف,75000,2024-03-31,1,المقيمون بالمملكة,5025,جمعية رحماء الصحية,الرياض,https://ehsan.sa/projects/0/47018?amount=null,رمضان
1022,P47814,تغطية تكاليف الولادة للمحتاجين,301500,2024-03-31,67,المواطنون والمقيمون بالمملكة,18349,جمعية زمزم الصحية,جدة,https://ehsan.sa/projects/0/46815?amount=null,رمضان
1023,P47655,عربات بيع الطعام للأرامل والمطلقات,297000,2024-03-31,9,المواطنون,13406,جمعية المودة للتنمية الأسرية,جدة,https://ehsan.sa/projects/0/46656?amount=null,رمضان
1024,P48006,زراعة القوقعة لطفلة,121900,2024-03-30,1,المقيمون بالمملكة,5027,الجمعية الصحية التطوعية في الزلفي,الزلفي,https://ehsan.sa/projects/0/47007?amount=null,رمضان
1025,P47997,وجبات الإفطار في ساحات الحرم المكي,300000,2024-03-30,20000,المواطنون والمقيمون بالمملكة,14196,جمعية أرزاق لحفظ النعمة,مكة المكرمة,https://ehsan.sa/projects/0/46998?amount=null,رمضان
1026,P48009,علاج الكلى لمريضة متعففة,39900,2024-03-30,1,المقيمون بالمملكة,1556,جمعية رحماء الصحية,الرياض,https://ehsan.sa/projects/0/47010?amount=null,رمضان
1027,P48011,عملية إغلاق ثقب القلب لطفل متعفف,64500,2024-03-30,1,المقيمون بالمملكة,3375,جمعية رحماء الصحية,الرياض,https://ehsan.sa/projects/0/47012?amount=null,رمضان
1028,P47858,كسوة الأيتام,10000,2024-03-30,50,المواطنون,580,الجمعية الخيرية لرعاية الايتام بتبوك,تبوك,https://ehsan.sa/projects/0/46859?amount=null,رمضان
1029,P47929,السلال الغذائية الرمضانية,396000,2024-03-30,330,المواطنون والمقيمون بالمملكة,22922,جمعية البر الخيرية بعشيرة,عشيرة,https://ehsan.sa/projects/0/46930?amount=null,رمضان
1030,P47975,رحلات العمرة للمتعففين,60000,2024-03-30,120,المواطنون,4417,جمعية التنمية الأهلية بالنماص,النماص,https://ehsan.sa/projects/0/46976?amount=null,رمضان
1031,P47971,سداد إيجار منازل الأسر المتعففة,372000,2024-03-30,31,المواطنون,18406,جمعية البر الأهلية بمركز وادي الحيا,وادي الحيا,https://ehsan.sa/projects/0/46972?amount=null,رمضان
1032,P47993,سحور الصائمين,300000,2024-03-30,20000,المواطنون والمقيمون بالمملكة,30142,جمعية حفظ النعمة بمنطقة مكة المكرمة,جدة,https://ehsan.sa/projects/0/46994?amount=null,رمضان
1033,P47970,سداد إيجارات الأسر المعسرة,62000,2024-03-29,6,المواطنون,1966,جمعية ثرمداء الخيرية,ثرمداء,https://ehsan.sa/projects/0/46971?amount=null,رمضان
1034,P47963,كسوة العيد,408300,2024-03-29,1361,المواطنون والمقيمون بالمملكة,26212,جمعية البر الخيرية بعشيرة,عشيرة,https://ehsan.sa/projects/0/46964?amount=null,رمضان
1035,P47964,رحلات العمرة للمحتاجين,150000,2024-03-29,500,المواطنون والمقيمون بالمملكة,9941,جمعية الدعوة والإرشاد وتوعية الجاليات بالحرجة,الحرجة,https://ehsan.sa/projects/0/46965?amount=null,رمضان
1036,P47995,إفطار الصائمين في الحرم,400005,2024-03-29,26667,المواطنون والمقيمون بالمملكة,21291,جمعية البر الخيرية بظلم,النزهة - مكة المكرمة,https://ehsan.sa/projects/0/46996?amount=null,رمضان
1037,P47973,دعم الأسر المحتاجة,350000,2024-03-29,35,المواطنون والمقيمون بالمملكة,7760,جمعية التنمية الأسرية في محافظة الأفلاج,الأفلاج,https://ehsan.sa/projects/0/46974?amount=null,رمضان
1038,P47980,سقيا الماء,500000,2024-03-29,500000,المواطنون والمقيمون بالمملكة,32552,جمعية التنمية الأهلية بالعرضية الشمالية,مكة المكرمة,https://ehsan.sa/projects/0/46981?amount=null,رمضان
1039,P47977,العمليات الجراحية لمرضى القلب المحتاجين,175000,2024-03-29,5,المقيمون بالمملكة,8938,جمعية رحماء الصحية,الرياض,https://ehsan.sa/projects/0/46978?amount=null,رمضان
1040,P47860,كسوة العيد,249200,2024-03-29,712,المواطنون,15732,جمعية البر الخيرية بمركز العالية,العالية,https://ehsan.sa/projects/0/46861?amount=null,رمضان
1041,P47992,كفالة مرضى الفشل الكلوي,132480,2024-03-29,3,المقيمون بالمملكة,5927,جمعية الكوثر الصحية بعسير,أبها,https://ehsan.sa/projects/0/46993?amount=null,رمضان
1042,P47946,بناء مسجد,2500000,2024-03-29,315,المواطنون والمقيمون بالمملكة,106536,جمعية العناية بالمساجد بالمنطقة الشرقية,الخبر,https://ehsan.sa/projects/0/46947?amount=null,رمضان
1043,P47990,وجبات الإفطار في ساحات الحرم المكي,375000,2024-03-29,25000,المواطنون والمقيمون بالمملكة,16124,جمعية مسارات الشبابية,مكة المكرمة,https://ehsan.sa/projects/0/46991?amount=null,رمضان
1044,P47936,تأثيث منازل الأيتام المتعففين,494400,2024-03-29,12,المواطنون,27673,جمعية بنيان للخدمات الاجتماعية,مكة المكرمة,https://ehsan.sa/projects/0/46937?amount=null,رمضان
1045,P47933,الدعم النفسي لكبار السن,64000,2024-03-29,80,المواطنون,2502,جمعية المودة للتنمية الأسرية,جدة,https://ehsan.sa/projects/0/46934?amount=null,رمضان
1046,P47974,تفريج كرب الأسر المحتاجة,350000,2024-03-29,175,المواطنون,6952,جمعية البر الأهلية بيشة,بيشة,https://ehsan.sa/projects/0/46975?amount=null,رمضان
1047,P47991,جلسات العلاج الكيميائي لمريضة سرطان الثدي,113936,2024-03-29,1,المقيمون بالمملكة,3035,جمعية رحماء الصحية,الرياض,https://ehsan.sa/projects/0/46992?amount=null,رمضان
1048,P47702,جلسات التخاطب للأطفال المحتاجين,230400,2024-03-29,24,المواطنون والمقيمون بالمملكة,6169,جمعية التدخل المبكر للأطفال ذوي الإعاقة,الرياض,https://ehsan.sa/projects/0/46703?amount=null,رمضان
1049,P47982,وجبات الإفطار في ساحات الحرم المكي,300000,2024-03-29,30000,المواطنون والمقيمون بالمملكة,8934,جمعية البر الخيرية بالشرائع,مكة المكرمة,https://ehsan.sa/projects/0/46983?amount=null,رمضان
1050,P47979,سقيا الماء,195000,2024-03-29,15000,المواطنون والمقيمون بالمملكة,17884,جمعية البر الخيرية بمركز فيضة اثقب,حائل,https://ehsan.sa/projects/0/46980?amount=null,رمضان
1051,P47557,إعانة المنقطعين وعابري السبيل,400000,2024-03-29,400,المواطنون والمقيمون بالمملكة,24184,جمعية إكرام عابري السبيل,الرياض,https://ehsan.sa/projects/0/46558?amount=null,رمضان
1052,P47739,توفير وجبات السحور للمحتاجين,525000,2024-03-29,35000,المواطنون والمقيمون بالمملكة,36368,جمعية البر الخيرية بالليث,مكة المكرمة,https://ehsan.sa/projects/0/46740?amount=null,رمضان
1053,P47938,سقيا الماء للأسر المتعففة,349300,2024-03-29,499,المواطنون,27280,جمعية أصدقاء العمل التطوعي بالجوف (يمناكم),سكاكا,https://ehsan.sa/projects/0/46943?amount=null,رمضان
1054,P47983,سحور الصائمين,210000,2024-03-29,14000,المواطنون والمقيمون بالمملكة,18537,جمعية البر الخيرية بالنويعمة,وادى الدواسر,https://ehsan.sa/projects/0/46984?amount=null,رمضان
1055,P47984,تعليم سورة الفاتحة,130000,2024-03-29,1000,المواطنون والمقيمون بالمملكة,8821,جمعية الشاطبي التعليمية,جدة,https://ehsan.sa/projects/0/46985?amount=null,رمضان
1056,P47981,وجبات إفطار الصائمين,225000,2024-03-29,15000,المواطنون والمقيمون بالمملكة,7222,جمعية بشائر الخير لحفظ النعمة,الخرج,https://ehsan.sa/projects/0/46982?amount=null,رمضان
1057,P47986,كفالة الأرامل والمطلقات,288000,2024-03-28,80,المواطنون,7409,جمعية البر الخيرية بمحافظة خليص,خليص,https://ehsan.sa/projects/0/46987?amount=null,رمضان
1058,P47684,كسوة الأسر المحتاجة,349200,2024-03-28,291,المواطنون,17231,جمعية فتاة ثقيف الخيرية النسائية بالطائف,الطائف,https://ehsan.sa/projects/0/46685?amount=null,رمضان
1059,P47978,جلسات العلاج الكيميائي لمريضة سرطان الدماغ,162855,2024-03-28,1,المقيمون بالمملكة,3899,جمعية رحماء الصحية,الرياض,https://ehsan.sa/projects/0/46979?amount=null,رمضان
1060,P47773,كفالة الأرامل والمطلقات,360000,2024-03-28,30,المواطنون,11520,جمعية ثرمداء الخيرية,ثرمداء,https://ehsan.sa/projects/0/46774?amount=null,رمضان
1061,P47813,جلسات العلاج الطبيعي لذوي الإعاقة,300000,2024-03-28,20,المواطنون,10855,جمعية رعاية المعاقين,طريف,https://ehsan.sa/projects/0/46814?amount=null,رمضان
1062,P47806,دعم المقبلين على الزواج,65000,2024-03-28,13,المواطنون,4985,جمعية أم الحمام الخيرية,القطيف,https://ehsan.sa/projects/0/46807?amount=null,رمضان
1063,P47965,رحلات العمرة للمحتاجين,142500,2024-03-28,500,المواطنون,9068,الجمعية السعودية الأهلية لرعاية الأرامل والمطلقات أيامى,الرياض,https://ehsan.sa/projects/0/46966?amount=null,رمضان
1064,P47972,توفير اللحوم للأسر المتعففة,116400,2024-03-28,97,المواطنون,6574,جمعية البر الاهلية بالعرضية الجنوبية,العرضية الجنوبية,https://ehsan.sa/projects/0/46973?amount=null,رمضان
1065,P47812,السماعات الطبية لضعيفي السمع,190000,2024-03-27,50,المواطنون والمقيمون بالمملكة,7470,جمعية بسمة معافى الصحية,حفر الباطن,https://ehsan.sa/projects/0/46813?amount=null,رمضان
1066,P47691,توفير الأجهزة الكهربائية للمحتاجين,144000,2024-03-27,72,المواطنون,8088,جمعية البر الخيرية بمركز المطرفية,الشنان,https://ehsan.sa/projects/0/46692?amount=null,رمضان
1067,P47962,دعم الأسر المحتاجة,300020,2024-03-27,35,المواطنون,6394,الجمعية النسائية الخيرية بالأفلاج,الأفلاج,https://ehsan.sa/projects/0/46963?amount=null,رمضان
1068,P47953,سقيا الماء,559872,2024-03-27,1728,المواطنون,37539,الجمعية الخيرية بمحافظة البرك,البرك,https://ehsan.sa/projects/0/46954?amount=null,رمضان
1069,P47969,الرعاية الصحية لمرضى الفشل الكلوي,110112,2024-03-27,24,المواطنون والمقيمون بالمملكة,3911,الجمعية الخيرية بمكه المكرمه,مكة المكرمة,https://ehsan.sa/projects/0/46970?amount=null,رمضان
1070,P47966,توفير الأدوية للمرضى المتعففين,245000,2024-03-27,735,المواطنون والمقيمون بالمملكة,5143,الامير مشعل بن عبدالله لذوي الاحتياجات الخاصة شمعة أمل,نجران,https://ehsan.sa/projects/0/46967?amount=null,رمضان
1071,P47968,استبدال أنبوب تغذية لمريض متعفف,38745,2024-03-27,1,المقيمون بالمملكة,548,جمعية رحماء الصحية,الرياض,https://ehsan.sa/projects/0/46969?amount=null,رمضان
1072,P47958,وجبات الإفطار في ساحات الحرم المكي,396000,2024-03-27,33000,المواطنون والمقيمون بالمملكة,13125,جمعية وفود الحرم,مكة المكرمة,https://ehsan.sa/projects/0/46959?amount=null,رمضان
1073,P47967,تركيب دعامات لمريض متعفف,25000,2024-03-27,1,المقيمون بالمملكة,716,جمعية رحماء الصحية,الرياض,https://ehsan.sa/projects/0/46968?amount=null,رمضان
1074,P47961,كفالة الأرامل والمطلقات,460800,2024-03-27,96,المواطنون,10862,جمعية الأيتام بمحافظة رنية,رنية,https://ehsan.sa/projects/0/46962?amount=null,رمضان
1075,P47952,إفطار الصائمين,250000,2024-03-27,25000,المواطنون والمقيمون بالمملكة,10567,جمعية الدعوة والإرشاد وتوعية الجاليات بالمجمعة,المجمعة,https://ehsan.sa/projects/0/46953?amount=null,رمضان
1076,P47807,دعم المقبلين على الزواج,250000,2024-03-27,10,المواطنون,17055,جمعية الثريا للمكفوفين,جازان,https://ehsan.sa/projects/0/46808?amount=null,رمضان
1077,P47957,وجبات السحور في الحرم المكي,399996,2024-03-27,33333,المواطنون والمقيمون بالمملكة,26483,وقف وفود الحرم,مكة المكرمة,https://ehsan.sa/projects/0/46958?amount=null,رمضان
1078,P47947,علاج مرضى سرطان الثدي,92210,2024-03-26,1,المقيمون بالمملكة,1943,جمعية بسمة معافى الصحية,حفر الباطن,https://ehsan.sa/projects/0/46948?amount=null,رمضان
1079,P47949,عملية جراحية لمصاب بانزلاق غضروفي,40000,2024-03-26,1,المقيمون بالمملكة,1020,جمعية رحماء الصحية,الرياض,https://ehsan.sa/projects/0/46950?amount=null,رمضان
1080,P47948,توفير أدوية التهاب العضلات الليفي,111150,2024-03-26,19,المواطنون والمقيمون بالمملكة,4354,الجمعية الصحية لرعاية مرضي الفايبرومياليجيا,الرياض,https://ehsan.sa/projects/0/46949?amount=null,رمضان
1081,P47959,زراعة أنبوب تفريغ السائل النخاعي لطفل مريض,35420,2024-03-26,1,المقيمون بالمملكة,744,جمعية رحماء الصحية,الرياض,https://ehsan.sa/projects/0/46960?amount=null,رمضان
1082,P47955,كفالة الأسر المتعففة,99000,2024-03-26,33,المواطنون,545,جمعية عطاء بكلية بمحافظة رابغ,رابغ,https://ehsan.sa/projects/0/46956?amount=null,رمضان
1083,P47943,دعم الأسر المحتاجة,301500,2024-03-26,201,المواطنون,4037,جمعية التنمية الاجتماعية النسائية بمحايل عسير,محايل عسير,https://ehsan.sa/projects/0/46944?amount=null,رمضان
1084,P47884,رحلات العمرة للمحتاجين,36000,2024-03-26,120,المواطنون والمقيمون بالمملكة,1377,جمعية الغوطة الخيرية بموقق,موقق,https://ehsan.sa/projects/0/46885?amount=null,رمضان
1085,P47954,وجبات الإفطار في ساحات الحرم المكي,500000,2024-03-26,62500,المواطنون والمقيمون بالمملكة,20073,جمعية نافع للأعمال التطوعية,مكة المكرمة,https://ehsan.sa/projects/0/46955?amount=null,رمضان
1086,P47944,تفريج كرب الأسر المحتاجة,350000,2024-03-25,10,المواطنون والمقيمون بالمملكة,11235,جمعية البر الخيرية بحفر الباطن,حفر الباطن,https://ehsan.sa/projects/0/46945?amount=null,رمضان
1087,P47880,سداد إيجار منازل الأسر المتعففة,210000,2024-03-25,14,المواطنون,5610,جمعية مسكن للإسكان التنموي,فيفاء,https://ehsan.sa/projects/0/46881?amount=null,رمضان
1088,P47882,وجبات إفطار الصائمين,399996,2024-03-25,33333,المواطنون والمقيمون بالمملكة,21398,جمعية وفود الحرم,مكة المكرمة,https://ehsan.sa/projects/0/46883?amount=null,رمضان
1089,P47649,توزيع اللحوم على الأسر المحتاجة,303360,2024-03-25,790,المواطنون,13436,جمعية رعاية الأيتام بتربة,تربة,https://ehsan.sa/projects/0/46650?amount=null,رمضان
1090,P47951,جلسات غسيل الكلى لمريض متعفف,32292,2024-03-25,1,المقيمون بالمملكة,548,جمعية رحماء الصحية,الرياض,https://ehsan.sa/projects/0/46952?amount=null,رمضان
1091,P47950,عملية عمود فقري لطفلة متعففة,75000,2024-03-25,1,المقيمون بالمملكة,2002,جمعية رحماء الصحية,الرياض,https://ehsan.sa/projects/0/46951?amount=null,رمضان
1092,P47937,كفالة الأرامل والمطلقات,270000,2024-03-25,150,المواطنون,4010,جمعية البر الخيرية بالسويرقية,السويرقية,https://ehsan.sa/projects/0/46938?amount=null,رمضان
1093,P47810,رحلات العمرة للمحتاجين,250000,2024-03-24,1250,المواطنون والمقيمون بالمملكة,19375,جمعية الدعوة والارشاد وتوعية الجاليات في المزاحمية,المزاحمية,https://ehsan.sa/projects/0/46811?amount=null,رمضان
1094,P47934,كسوة العيد,354600,2024-03-24,591,المواطنون والمقيمون بالمملكة,16546,جمعية رفحاء الخيرية,رفحاء,https://ehsan.sa/projects/0/46935?amount=null,رمضان
1095,P47935,وجبات الإفطار في ساحات الحرم المكي,360000,2024-03-24,45000,المواطنون والمقيمون بالمملكة,19323,جمعية البر الخيرية بمحافظة خليص,مكة المكرمة,https://ehsan.sa/projects/0/46936?amount=null,رمضان
1096,P47811,رحلات العمرة لمن يعانين من الإعاقة,140000,2024-03-24,200,المواطنون,9160,جمعية التنمية الاجتماعية النسائية بمحايل عسير,محايل عسير,https://ehsan.sa/projects/0/46812?amount=null,رمضان
1097,P47914,دعم الأسر المحتاجة,349500,2024-03-24,233,المواطنون,12009,جمعية البر الخيرية بالسرح,السرح,https://ehsan.sa/projects/0/46915?amount=null,رمضان
1098,P47802,إستكمال بناء جامع,2578567,2024-03-24,257,المواطنون والمقيمون بالمملكة,135328,جمعية العناية بمساجد الطرق,الباحة,https://ehsan.sa/projects/0/46803?amount=null,رمضان
