,Case Number,Project Names,Amount,Date,Beneficiaries,Beneficiary type,Number of donations,Partner,Location,Details URL
1010,P48033,قسطرة قلب لمريضة متعففة,"18,454ر.س",31/03/2024,1,المقيمون بالمملكة,937,جمعية الإحسان الطبية الخيرية,جازان,https://ehsan.sa/projects/0/47034?amount=null
1011,P47996,وجبات إفطار الصائمين,"225,000ر.س",31/03/2024,750,المواطنون,"11,706",جمعية أصدقاء العمل التطوعي بالجوف (يمناكم),سكاكا,https://ehsan.sa/projects/0/46997?amount=null
1012,P48002,كفالة الأرامل والمطلقات,"280,000ر.س",31/03/2024,350,المواطنون,"6,526",الجمعية الخيرية بأبي عريش,أبي عريش,https://ehsan.sa/projects/0/47003?amount=null
1013,P48004,رحلات العمرة للمحتاجين,"50,625ر.س",31/03/2024,45,المواطنون,"3,738",جمعية إجلال لمساندة كبار السن بالأفلاج,الأفلاج,https://ehsan.sa/projects/0/47005?amount=null
1014,P48005,رحلات العمرة للمحتاجين,"240,000ر.س",31/03/2024,960,المواطنون والمقيمون بالمملكة,"18,591",جمعية الدعوة والإرشاد بمحافظة الدلم,الدلم,https://ehsan.sa/projects/0/47006?amount=null
1015,P48010,سداد إيجار منازل الأسر المتعففة,"261,000ر.س",31/03/2024,58,المواطنون والمقيمون بالمملكة,"6,465",الجمعية السعودية الخيرية للفصام ( احتواء),الرياض,https://ehsan.sa/projects/0/47011?amount=null
1016,P48008,العمليات الجراحية للمحتاجين,"200,000ر.س",31/03/2024,40,المواطنون والمقيمون بالمملكة,"9,381",جمعية مراس الصحية,أبها,https://ehsan.sa/projects/0/47009?amount=null
1017,P48012,سحور الصائمين في الحرم,"450,000ر.س",31/03/2024,"30,000",المواطنون والمقيمون بالمملكة,"34,730",جمعية عائل للرعاية الأسرية بمحافظة تربة,مكة المكرمة,https://ehsan.sa/projects/0/47013?amount=null
1018,P47770,إعانة أسر السجناء,"300,070ر.س",31/03/2024,74,المواطنون,"14,611",جمعية ايأدي الأمل للتوعية بأضرار المخدرات ورعاية المتعافين,محايل عسير,https://ehsan.sa/projects/0/46771?amount=null
1019,P48014,وجبات الإفطار في ساحات الحرم المكي,"390,000ر.س",31/03/2024,"30,000",المواطنون والمقيمون بالمملكة,"24,545",الجمعية الخيرية ببحرة (يسر),مكة المكرمة,https://ehsan.sa/projects/0/47017?amount=null
1020,P47671,البرامج التأهيلية للمتعافين من الإدمان,"120,000ر.س",31/03/2024,100,المواطنون,"7,991",جمعية واثق,تبوك,https://ehsan.sa/projects/0/46672?amount=null
1021,P48017,عملية قلب مفتوح لمريض متعفف,"75,000ر.س",31/03/2024,1,المقيمون بالمملكة,"5,025",جمعية رحماء الصحية,الرياض,https://ehsan.sa/projects/0/47018?amount=null
1022,P47814,تغطية تكاليف الولادة للمحتاجين,"301,500ر.س",31/03/2024,67,المواطنون والمقيمون بالمملكة,"18,349",جمعية زمزم الصحية,جدة,https://ehsan.sa/projects/0/46815?amount=null
1023,P47655,عربات بيع الطعام للأرامل والمطلقات,"297,000ر.س",31/03/2024,9,المواطنون,"13,406",جمعية المودة للتنمية الأسرية,جدة,https://ehsan.sa/projects/0/46656?amount=null
1024,P48006,زراعة القوقعة لطفلة,"121,900ر.س",30/03/2024,1,المقيمون بالمملكة,"5,027",الجمعية الصحية التطوعية في الزلفي,الزلفي,https://ehsan.sa/projects/0/47007?amount=null
1025,P47997,وجبات الإفطار في ساحات الحرم المكي,"300,000ر.س",30/03/2024,"20,000",المواطنون والمقيمون بالمملكة,"14,196",جمعية أرزاق لحفظ النعمة,مكة المكرمة,https://ehsan.sa/projects/0/46998?amount=null
1026,P48009,علاج الكلى لمريضة متعففة,"39,900ر.س",30/03/2024,1,المقيمون بالمملكة,"1,556",جمعية رحماء الصحية,الرياض,https://ehsan.sa/projects/0/47010?amount=null
1027,P48011,عملية إغلاق ثقب القلب لطفل متعفف,"64,500ر.س",30/03/2024,1,المقيمون بالمملكة,"3,375",جمعية رحماء الصحية,الرياض,https://ehsan.sa/projects/0/47012?amount=null
1028,P47858,كسوة الأيتام,"10,000ر.س",30/03/2024,50,المواطنون,580,الجمعية الخيرية لرعاية الايتام بتبوك,تبوك,https://ehsan.sa/projects/0/46859?amount=null
1029,P47929,السلال الغذائية الرمضانية,"396,000ر.س",30/03/2024,330,المواطنون والمقيمون بالمملكة,"22,922",جمعية البر الخيرية بعشيرة,عشيرة,https://ehsan.sa/projects/0/46930?amount=null
1030,P47975,رحلات العمرة للمتعففين,"60,000ر.س",30/03/2024,120,المواطنون,"4,417",جمعية التنمية الأهلية بالنماص,النماص,https://ehsan.sa/projects/0/46976?amount=null
1031,P47971,سداد إيجار منازل الأسر المتعففة,"372,000ر.س",30/03/2024,31,المواطنون,"18,406",جمعية البر الأهلية بمركز وادي الحيا,وادي الحيا,https://ehsan.sa/projects/0/46972?amount=null
1032,P47993,سحور الصائمين,"300,000ر.س",30/03/2024,"20,000",المواطنون والمقيمون بالمملكة,"30,142",جمعية حفظ النعمة بمنطقة مكة المكرمة,جدة,https://ehsan.sa/projects/0/46994?amount=null
1033,P47970,سداد إيجارات الأسر المعسرة,"62,000ر.س",29/03/2024,6,المواطنون,"1,966",جمعية ثرمداء الخيرية,ثرمداء,https://ehsan.sa/projects/0/46971?amount=null
1034,P47963,كسوة العيد,"408,300ر.س",29/03/2024,"1,361",المواطنون والمقيمون بالمملكة,"26,212",جمعية البر الخيرية بعشيرة,عشيرة,https://ehsan.sa/projects/0/46964?amount=null
1035,P47964,رحلات العمرة للمحتاجين,"150,000ر.س",29/03/2024,500,المواطنون والمقيمون بالمملكة,"9,941",جمعية الدعوة والإرشاد وتوعية الجاليات بالحرجة,الحرجة,https://ehsan.sa/projects/0/46965?amount=null
1036,P47995,إفطار الصائمين في الحرم,"400,005ر.س",29/03/2024,"26,667",المواطنون والمقيمون بالمملكة,"21,291",جمعية البر الخيرية بظلم,النزهة - مكة المكرمة,https://ehsan.sa/projects/0/46996?amount=null
1037,P47973,دعم الأسر المحتاجة,"350,000ر.س",29/03/2024,35,المواطنون والمقيمون بالمملكة,"7,760",جمعية التنمية الأسرية في محافظة الأفلاج,الأفلاج,https://ehsan.sa/projects/0/46974?amount=null
1038,P47980,سقيا الماء,"500,000ر.س",29/03/2024,"500,000",المواطنون والمقيمون بالمملكة,"32,552",جمعية التنمية الأهلية بالعرضية الشمالية,مكة المكرمة,https://ehsan.sa/projects/0/46981?amount=null
1039,P47977,العمليات الجراحية لمرضى القلب المحتاجين,"175,000ر.س",29/03/2024,5,المقيمون بالمملكة,"8,938",جمعية رحماء الصحية,الرياض,https://ehsan.sa/projects/0/46978?amount=null
1040,P47860,كسوة العيد,"249,200ر.س",29/03/2024,712,المواطنون,"15,732",جمعية البر الخيرية بمركز العالية,العالية,https://ehsan.sa/projects/0/46861?amount=null
1041,P47992,كفالة مرضى الفشل الكلوي,"132,480ر.س",29/03/2024,3,المقيمون بالمملكة,"5,927",جمعية الكوثر الصحية بعسير,أبها,https://ehsan.sa/projects/0/46993?amount=null
1042,P47946,بناء مسجد,"2,500,000ر.س",29/03/2024,315,المواطنون والمقيمون بالمملكة,"106,536",جمعية العناية بالمساجد بالمنطقة الشرقية,الخبر,https://ehsan.sa/projects/0/46947?amount=null
1043,P47990,وجبات الإفطار في ساحات الحرم المكي,"375,000ر.س",29/03/2024,"25,000",المواطنون والمقيمون بالمملكة,"16,124",جمعية مسارات الشبابية,مكة المكرمة,https://ehsan.sa/projects/0/46991?amount=null
1044,P47936,تأثيث منازل الأيتام المتعففين,"494,400ر.س",29/03/2024,12,المواطنون,"27,673",جمعية بنيان للخدمات الاجتماعية,مكة المكرمة,https://ehsan.sa/projects/0/46937?amount=null
1045,P47933,الدعم النفسي لكبار السن,"64,000ر.س",29/03/2024,80,المواطنون,"2,502",جمعية المودة للتنمية الأسرية,جدة,https://ehsan.sa/projects/0/46934?amount=null
1046,P47974,تفريج كرب الأسر المحتاجة,"350,000ر.س",29/03/2024,175,المواطنون,"6,952",جمعية البر الأهلية بيشة,بيشة,https://ehsan.sa/projects/0/46975?amount=null
1047,P47991,جلسات العلاج الكيميائي لمريضة سرطان الثدي,"113,936ر.س",29/03/2024,1,المقيمون بالمملكة,"3,035",جمعية رحماء الصحية,الرياض,https://ehsan.sa/projects/0/46992?amount=null
1048,P47702,جلسات التخاطب للأطفال المحتاجين,"230,400ر.س",29/03/2024,24,المواطنون والمقيمون بالمملكة,"6,169",جمعية التدخل المبكر للأطفال ذوي الإعاقة,الرياض,https://ehsan.sa/projects/0/46703?amount=null
1049,P47982,وجبات الإفطار في ساحات الحرم المكي,"300,000ر.س",29/03/2024,"30,000",المواطنون والمقيمون بالمملكة,"8,934",جمعية البر الخيرية بالشرائع,مكة المكرمة,https://ehsan.sa/projects/0/46983?amount=null
1050,P47979,سقيا الماء,"195,000ر.س",29/03/2024,"15,000",المواطنون والمقيمون بالمملكة,"17,884",جمعية البر الخيرية بمركز فيضة اثقب,حائل,https://ehsan.sa/projects/0/46980?amount=null
1051,P47557,إعانة المنقطعين وعابري السبيل,"400,000ر.س",29/03/2024,400,المواطنون والمقيمون بالمملكة,"24,184",جمعية إكرام عابري السبيل,الرياض,https://ehsan.sa/projects/0/46558?amount=null
1052,P47739,توفير وجبات السحور للمحتاجين,"525,000ر.س",29/03/2024,"35,000",المواطنون والمقيمون بالمملكة,"36,368",جمعية البر الخيرية بالليث,مكة المكرمة,https://ehsan.sa/projects/0/46740?amount=null
1053,P47938,سقيا الماء للأسر المتعففة,"349,300ر.س",29/03/2024,499,المواطنون,"27,280",جمعية أصدقاء العمل التطوعي بالجوف (يمناكم),سكاكا,https://ehsan.sa/projects/0/46943?amount=null
1054,P47983,سحور الصائمين,"210,000ر.س",29/03/2024,"14,000",المواطنون والمقيمون بالمملكة,"18,537",جمعية البر الخيرية بالنويعمة,وادى الدواسر,https://ehsan.sa/projects/0/46984?amount=null
1055,P47984,تعليم سورة الفاتحة,"130,000ر.س",29/03/2024,"1,000",المواطنون والمقيمون بالمملكة,"8,821",جمعية الشاطبي التعليمية,جدة,https://ehsan.sa/projects/0/46985?amount=null
1056,P47981,وجبات إفطار الصائمين,"225,000ر.س",29/03/2024,"15,000",المواطنون والمقيمون بالمملكة,"7,222",جمعية بشائر الخير لحفظ النعمة,الخرج,https://ehsan.sa/projects/0/46982?amount=null
1057,P47986,كفالة الأرامل والمطلقات,"288,000ر.س",28/03/2024,80,المواطنون,"7,409",جمعية البر الخيرية بمحافظة خليص,خليص,https://ehsan.sa/projects/0/46987?amount=null
1058,P47684,كسوة الأسر المحتاجة,"349,200ر.س",28/03/2024,291,المواطنون,"17,231",جمعية فتاة ثقيف الخيرية النسائية بالطائف,الطائف,https://ehsan.sa/projects/0/46685?amount=null
1059,P47978,جلسات العلاج الكيميائي لمريضة سرطان الدماغ,"162,855ر.س",28/03/2024,1,المقيمون بالمملكة,"3,899",جمعية رحماء الصحية,الرياض,https://ehsan.sa/projects/0/46979?amount=null
1060,P47773,كفالة الأرامل والمطلقات,"360,000ر.س",28/03/2024,30,المواطنون,"11,520",جمعية ثرمداء الخيرية,ثرمداء,https://ehsan.sa/projects/0/46774?amount=null
1061,P47813,جلسات العلاج الطبيعي لذوي الإعاقة,"300,000ر.س",28/03/2024,20,المواطنون,"10,855",جمعية رعاية المعاقين,طريف,https://ehsan.sa/projects/0/46814?amount=null
1062,P47806,دعم المقبلين على الزواج,"65,000ر.س",28/03/2024,13,المواطنون,"4,985",جمعية أم الحمام الخيرية,القطيف,https://ehsan.sa/projects/0/46807?amount=null
1063,P47965,رحلات العمرة للمحتاجين,"142,500ر.س",28/03/2024,500,المواطنون,"9,068",الجمعية السعودية الأهلية لرعاية الأرامل والمطلقات أيامى,الرياض,https://ehsan.sa/projects/0/46966?amount=null
1064,P47972,توفير اللحوم للأسر المتعففة,"116,400ر.س",28/03/2024,97,المواطنون,"6,574",جمعية البر الاهلية بالعرضية الجنوبية,العرضية الجنوبية,https://ehsan.sa/projects/0/46973?amount=null
1065,P47812,السماعات الطبية لضعيفي السمع,"190,000ر.س",27/03/2024,50,المواطنون والمقيمون بالمملكة,"7,470",جمعية بسمة معافى الصحية,حفر الباطن,https://ehsan.sa/projects/0/46813?amount=null
1066,P47691,توفير الأجهزة الكهربائية للمحتاجين,"144,000ر.س",27/03/2024,72,المواطنون,"8,088",جمعية البر الخيرية بمركز المطرفية,الشنان,https://ehsan.sa/projects/0/46692?amount=null
1067,P47962,دعم الأسر المحتاجة,"300,020ر.س",27/03/2024,35,المواطنون,"6,394",الجمعية النسائية الخيرية بالأفلاج,الأفلاج,https://ehsan.sa/projects/0/46963?amount=null
1068,P47953,سقيا الماء,"559,872ر.س",27/03/2024,"1,728",المواطنون,"37,539",الجمعية الخيرية بمحافظة البرك,البرك,https://ehsan.sa/projects/0/46954?amount=null
1069,P47969,الرعاية الصحية لمرضى الفشل الكلوي,"110,112ر.س",27/03/2024,24,المواطنون والمقيمون بالمملكة,"3,911",الجمعية الخيرية بمكه المكرمه,مكة المكرمة,https://ehsan.sa/projects/0/46970?amount=null
1070,P47966,توفير الأدوية للمرضى المتعففين,"245,000ر.س",27/03/2024,735,المواطنون والمقيمون بالمملكة,"5,143",الامير مشعل بن عبدالله لذوي الاحتياجات الخاصة شمعة أمل,نجران,https://ehsan.sa/projects/0/46967?amount=null
1071,P47968,استبدال أنبوب تغذية لمريض متعفف,"38,745ر.س",27/03/2024,1,المقيمون بالمملكة,548,جمعية رحماء الصحية,الرياض,https://ehsan.sa/projects/0/46969?amount=null
1072,P47958,وجبات الإفطار في ساحات الحرم المكي,"396,000ر.س",27/03/2024,"33,000",المواطنون والمقيمون بالمملكة,"13,125",جمعية وفود الحرم,مكة المكرمة,https://ehsan.sa/projects/0/46959?amount=null
1073,P47967,تركيب دعامات لمريض متعفف,"25,000ر.س",27/03/2024,1,المقيمون بالمملكة,716,جمعية رحماء الصحية,الرياض,https://ehsan.sa/projects/0/46968?amount=null
1074,P47961,كفالة الأرامل والمطلقات,"460,800ر.س",27/03/2024,96,المواطنون,"10,862",جمعية الأيتام بمحافظة رنية,رنية,https://ehsan.sa/projects/0/46962?amount=null
1075,P47952,إفطار الصائمين,"250,000ر.س",27/03/2024,"25,000",المواطنون والمقيمون بالمملكة,"10,567",جمعية الدعوة والإرشاد وتوعية الجاليات بالمجمعة,المجمعة,https://ehsan.sa/projects/0/46953?amount=null
1076,P47807,دعم المقبلين على الزواج,"250,000ر.س",27/03/2024,10,المواطنون,"17,055",جمعية الثريا للمكفوفين,جازان,https://ehsan.sa/projects/0/46808?amount=null
1077,P47957,وجبات السحور في الحرم المكي,"399,996ر.س",27/03/2024,"33,333",المواطنون والمقيمون بالمملكة,"26,483",وقف وفود الحرم,مكة المكرمة,https://ehsan.sa/projects/0/46958?amount=null
1078,P47947,علاج مرضى سرطان الثدي,"92,210ر.س",26/03/2024,1,المقيمون بالمملكة,"1,943",جمعية بسمة معافى الصحية,حفر الباطن,https://ehsan.sa/projects/0/46948?amount=null
1079,P47949,عملية جراحية لمصاب بانزلاق غضروفي,"40,000ر.س",26/03/2024,1,المقيمون بالمملكة,"1,020",جمعية رحماء الصحية,الرياض,https://ehsan.sa/projects/0/46950?amount=null
1080,P47948,توفير أدوية التهاب العضلات الليفي,"111,150ر.س",26/03/2024,19,المواطنون والمقيمون بالمملكة,"4,354",الجمعية الصحية لرعاية مرضي الفايبرومياليجيا,الرياض,https://ehsan.sa/projects/0/46949?amount=null
1081,P47959,زراعة أنبوب تفريغ السائل النخاعي لطفل مريض,"35,420ر.س",26/03/2024,1,المقيمون بالمملكة,744,جمعية رحماء الصحية,الرياض,https://ehsan.sa/projects/0/46960?amount=null
1082,P47955,كفالة الأسر المتعففة,"99,000ر.س",26/03/2024,33,المواطنون,545,جمعية عطاء بكلية بمحافظة رابغ,رابغ,https://ehsan.sa/projects/0/46956?amount=null
1083,P47943,دعم الأسر المحتاجة,"301,500ر.س",26/03/2024,201,المواطنون,"4,037",جمعية التنمية الاجتماعية النسائية بمحايل عسير,محايل عسير,https://ehsan.sa/projects/0/46944?amount=null
1084,P47884,رحلات العمرة للمحتاجين,"36,000ر.س",26/03/2024,120,المواطنون والمقيمون بالمملكة,"1,377",جمعية الغوطة الخيرية بموقق,موقق,https://ehsan.sa/projects/0/46885?amount=null
1085,P47954,وجبات الإفطار في ساحات الحرم المكي,"500,000ر.س",26/03/2024,"62,500",المواطنون والمقيمون بالمملكة,"20,073",جمعية نافع للأعمال التطوعية,مكة المكرمة,https://ehsan.sa/projects/0/46955?amount=null
1086,P47944,تفريج كرب الأسر المحتاجة,"350,000ر.س",25/03/2024,10,المواطنون والمقيمون بالمملكة,"11,235",جمعية البر الخيرية بحفر الباطن,حفر الباطن,https://ehsan.sa/projects/0/46945?amount=null
1087,P47880,سداد إيجار منازل الأسر المتعففة,"210,000ر.س",25/03/2024,14,المواطنون,"5,610",جمعية مسكن للإسكان التنموي,فيفاء,https://ehsan.sa/projects/0/46881?amount=null
1088,P47882,وجبات إفطار الصائمين,"399,996ر.س",25/03/2024,"33,333",المواطنون والمقيمون بالمملكة,"21,398",جمعية وفود الحرم,مكة المكرمة,https://ehsan.sa/projects/0/46883?amount=null
1089,P47649,توزيع اللحوم على الأسر المحتاجة,"303,360ر.س",25/03/2024,790,المواطنون,"13,436",جمعية رعاية الأيتام بتربة,تربة,https://ehsan.sa/projects/0/46650?amount=null
1090,P47951,جلسات غسيل الكلى لمريض متعفف,"32,292ر.س",25/03/2024,1,المقيمون بالمملكة,548,جمعية رحماء الصحية,الرياض,https://ehsan.sa/projects/0/46952?amount=null
1091,P47950,عملية عمود فقري لطفلة متعففة,"75,000ر.س",25/03/2024,1,المقيمون بالمملكة,"2,002",جمعية رحماء الصحية,الرياض,https://ehsan.sa/projects/0/46951?amount=null
1092,P47937,كفالة الأرامل والمطلقات,"270,000ر.س",25/03/2024,150,المواطنون,"4,010",جمعية البر الخيرية بالسويرقية,السويرقية,https://ehsan.sa/projects/0/46938?amount=null
1093,P47810,رحلات العمرة للمحتاجين,"250,000ر.س",24/03/2024,"1,250",المواطنون والمقيمون بالمملكة,"19,375",جمعية الدعوة والارشاد وتوعية الجاليات في المزاحمية,المزاحمية,https://ehsan.sa/projects/0/46811?amount=null
1094,P47934,كسوة العيد,"354,600ر.س",24/03/2024,591,المواطنون والمقيمون بالمملكة,"16,546",جمعية رفحاء الخيرية,رفحاء,https://ehsan.sa/projects/0/46935?amount=null
1095,P47935,وجبات الإفطار في ساحات الحرم المكي,"360,000ر.س",24/03/2024,"45,000",المواطنون والمقيمون بالمملكة,"19,323",جمعية البر الخيرية بمحافظة خليص,مكة المكرمة,https://ehsan.sa/projects/0/46936?amount=null
1096,P47811,رحلات العمرة لمن يعانين من الإعاقة,"140,000ر.س",24/03/2024,200,المواطنون,"9,160",جمعية التنمية الاجتماعية النسائية بمحايل عسير,محايل عسير,https://ehsan.sa/projects/0/46812?amount=null
1097,P47914,دعم الأسر المحتاجة,"349,500ر.س",24/03/2024,233,المواطنون,"12,009",جمعية البر الخيرية بالسرح,السرح,https://ehsan.sa/projects/0/46915?amount=null
1098,P47802,إستكمال بناء جامع,"2,578,567ر.س",24/03/2024,257,المواطنون والمقيمون بالمملكة,"135,328",جمعية العناية بمساجد الطرق,الباحة,https://ehsan.sa/projects/0/46803?amount=null
1099,P47886,سقيا الماء,"313,200ر.س",24/03/2024,116,المواطنون,"28,168",جمعية البر الخيرية بمركز حقال بمنطقة مكة المكرمة,حقال,https://ehsan.sa/projects/0/46887?amount=null
1100,P47931,جلسات غسيل الكلى للمحتاجين,"333,450ر.س",24/03/2024,90,المقيمون بالمملكة,"16,203",جمعية أطباء طيبة الطبية الخيرية حياة,المدينة المنورة,https://ehsan.sa/projects/0/46932?amount=null
1101,P47705,بناء جامع,"4,000,000ر.س",24/03/2024,400,المواطنون والمقيمون بالمملكة,"192,631",جمعية العناية بمساجد الطرق,السليل,https://ehsan.sa/projects/0/46706?amount=null
1102,P47932,وجبات الإفطار في ساحات الحرم المكي,"300,000ر.س",24/03/2024,"30,000",المواطنون والمقيمون بالمملكة,"16,774",جمعية حفاوة لخدمة الحاج والمعتمر والزائر,مكة المكرمة,https://ehsan.sa/projects/0/46933?amount=null
1103,P47784,وجبات الإفطار في ساحات الحرم المكي,"500,000ر.س",24/03/2024,"50,000",المواطنون والمقيمون بالمملكة,"21,844",جمعية البر الخيرية بالخرمة,مكة المكرمة,https://ehsan.sa/projects/0/46785?amount=null
1104,P47911,كسوة العيد,"246,000ر.س",24/03/2024,246,المواطنون,"15,158",جمعية البر بمركز الجوة,الجوة,https://ehsan.sa/projects/0/46912?amount=null
1105,P47930,عملية جراحية لمريض تشوه خلقي في القلب,"46,637ر.س",24/03/2024,1,المقيمون بالمملكة,649,جمعية الإحسان الطبية الخيرية,جازان,https://ehsan.sa/projects/0/46931?amount=null
1106,P47844,إفطار الصائمين,"225,000ر.س",23/03/2024,"15,000",المواطنون والمقيمون بالمملكة,"10,584",جمعية البر الخيريه بوادي محرم والهدا,الهدا,https://ehsan.sa/projects/0/46845?amount=null
1107,P47781,السلال الغذائية الرمضانية للأسر المحتاجة,"212,512ر.س",23/03/2024,458,المواطنون,"8,886",جمعية البر الخيرية بمركز شثاث,أملج,https://ehsan.sa/projects/0/46782?amount=null
1108,P47744,إعانة أسر السجناء,"204,000ر.س",23/03/2024,17,المواطنون,"7,590",جمعية البر الخيرية بمحافظة هروب,هروب,https://ehsan.sa/projects/0/46745?amount=null
1109,P47881,تأمين جلسات العلاج الكيميائي لمرضى السرطان,"245,520ر.س",23/03/2024,9,المقيمون بالمملكة,"7,678",الجمعية الخيرية لتوفير الدواء للجميع بمكة المكرمة,مكة المكرمة,https://ehsan.sa/projects/0/46882?amount=null
1110,P47778,الرعاية الصحية للمحتاجين,"302,400ر.س",23/03/2024,21,المواطنون والمقيمون بالمملكة,"10,117",جمعية بادر الأجهزة الطبية,جدة,https://ehsan.sa/projects/0/46779?amount=null
1111,P47859,كسوة العيد,"244,500ر.س",23/03/2024,489,المواطنون والمقيمون بالمملكة,"13,595",جمعية البر الخيرية بالرين,الرين,https://ehsan.sa/projects/0/46860?amount=null
