,Case Number,Project Names,Amount,Date,Beneficiaries,Beneficiary type,Number of donations,Partner,Location,Details URL
404,P48668,سقيا الماء للأسر المتعففة,"105,400ر.س",23/08/2024,141,المواطنون,"8,148",جمعية البر الخيرية بمركز الأحمر,الأحمر,https://ehsan.sa/projects/0/47669?amount=null
405,P48664,سقيا الماء لضيوف الرحمن,"196,000ر.س",23/08/2024,"196,000",المواطنون والمقيمون بالمملكة,"17,606",جمعية الماء المعين,النزهة - مكة المكرمة,https://ehsan.sa/projects/0/47665?amount=null
406,P48051,الرعاية الصحية للمرضى المتعففين,"5,000,000ر.س",22/08/2024,500,المواطنون والمقيمون بالمملكة,"241,450",صندوق الوقف الصحي,الرياض,https://ehsan.sa/projects/0/47052?amount=null
407,P48662,سقيا الماء,"102,000ر.س",22/08/2024,170,المواطنون,"9,308",جمعية البر الخيرية بالعش,الشنان,https://ehsan.sa/projects/0/47663?amount=null
408,P48628,دعم المقبلين على الزواج,"330,000ر.س",21/08/2024,22,المواطنون,"27,622",جمعية البر الخيرية بالأخاشيم,الأخاشيم,https://ehsan.sa/projects/0/47630?amount=null
409,P48654,المستلزمات المدرسية للطلاب المتعففين,"57,200ر.س",21/08/2024,141,المواطنون,"4,881",جمعية البر الخيرية بمركز الأحمر,الأحمر,https://ehsan.sa/projects/0/47655?amount=null
410,P48584,صيانة أجهزة قوقعة الأذن للأطفال,"450,000ر.س",20/08/2024,100,المواطنون,"30,751",جمعية الأطفال زارعي القوقعة,الرياض,https://ehsan.sa/projects/0/47585?amount=null
411,P48647,السلال الغذائية للأسر المتعففة,"237,150ر.س",19/08/2024,527,المواطنون,"16,784",جمعية كحلا للخدمات الإنسانية,كحلا,https://ehsan.sa/projects/0/47648?amount=null
412,P48653,المستلزمات الدراسية لطلاب وطالبات الأسر المتعففة,"45,000ر.س",19/08/2024,150,المواطنون والمقيمون بالمملكة,"2,732",جمعية التنمية الأهلية بمزهرة,الحكامية,https://ehsan.sa/projects/0/47654?amount=null
413,P48651,الحقيبة المدرسية للطلاب المتعففين,"44,750ر.س",18/08/2024,179,المواطنون,"2,469",جمعية البر الخيرية بالخشيبي,بريدة,https://ehsan.sa/projects/0/47652?amount=null
414,P48642,تفريج كرب المتعففين,"300,000ر.س",18/08/2024,20,المقيمون بالمملكة,"19,591",جمعية قرن ظبي الخيرية للخدمات الاجتماعية,بني حسن,https://ehsan.sa/projects/0/47643?amount=null
415,P48639,التكفل بالعمرة لذوي الإعاقة,"50,000ر.س",18/08/2024,60,المواطنون,"2,998",جمعية قادرون للأشخاص ذوي الإعاقة بمحافظة شقراء,شقراء,https://ehsan.sa/projects/0/47640?amount=null
416,P48648,سقيا الماء,"500,000ر.س",17/08/2024,"1,000",المواطنون والمقيمون بالمملكة,"42,782",الجمعية الخيرية ببني سعد,بنى سعد,https://ehsan.sa/projects/0/47649?amount=null
417,P48646,تأثيث منازل المتعففين,"144,000ر.س",17/08/2024,24,المواطنون,"5,863",جمعية المكفوفين بينبع خطوة,ينبع,https://ehsan.sa/projects/0/47647?amount=null
418,P48649,المستلزمات الدراسية للطلاب,"185,000ر.س",17/08/2024,340,المقيمون بالمملكة,"11,586",جمعية العوامية الخيرية للخدمات الاجتماعية,العوامية,https://ehsan.sa/projects/0/47650?amount=null
419,P48650,الفسحة المدرسية لطلاب الأسر المتعففة,"290,500ر.س",17/08/2024,415,المواطنون,"16,949",جمعية البر الخيرية ببني حسن,بني حسن,https://ehsan.sa/projects/0/47651?amount=null
420,P48563,الأجهزة الكهربائية للمتعففين,"179,000ر.س",16/08/2024,88,المواطنون,"12,637",جمعية الخدمات الانسانية في نجخ الجنوبي,ضرية,https://ehsan.sa/projects/0/47564?amount=null
421,P48489,الكفالة التعليمية للطلاب المتعففين,"1,138,500ر.س",16/08/2024,198,المواطنون,"81,776",معهد البحوث والدراسات الجامعة السعودية الإلكترونية,الرياض,https://ehsan.sa/projects/0/47490?amount=null
422,P48633,وجبات الطعام للأسر المتعففة,"237,600ر.س",16/08/2024,93,المواطنون,"19,480",جمعية أكرمها لحفظ النعمة بمنطقة الباحة,بني حسن,https://ehsan.sa/projects/0/47634?amount=null
423,P48631,رحلات العمرة للمتعففين,"210,000ر.س",16/08/2024,600,المواطنون والمقيمون بالمملكة,"18,984",جمعية الدعوة والإرشاد وتوعية الجاليات في سميراء,سميراء,https://ehsan.sa/projects/0/47632?amount=null
424,P48569,منافذ البيع للأرامل والمطلقات,"297,000ر.س",16/08/2024,9,المواطنون,"20,268",جمعية المودة للتنمية الأسرية,جدة,https://ehsan.sa/projects/0/47570?amount=null
425,P48600,تأثيث منازل المتعففين,"225,600ر.س",16/08/2024,47,المواطنون,"19,283",جمعية البر الخيرية بالخشيبي,بريدة,https://ehsan.sa/projects/0/47601?amount=null
426,P48626,ترميم مساكن الأسر المتعففة,"380,000ر.س",15/08/2024,13,المواطنون,"30,096",جمعية رعاية الايتام بمحافظة الحجرة,الحجرة,https://ehsan.sa/projects/0/47627?amount=null
427,P48634,السلال الغذائية للأسر المتعففة,"300,000ر.س",15/08/2024,"1,000",المواطنون,"22,696",جمعية البر الخيرية والخدمات الاجتماعية بمركز الواسطة,الواسطة,https://ehsan.sa/projects/0/47636?amount=null
428,P48636,سقيا الماء لضيوف الرحمن,"500,000ر.س",15/08/2024,"500,000",المواطنون والمقيمون بالمملكة,"50,257",جمعية البر الخيرية بالسويرقية,مكة المكرمة,https://ehsan.sa/projects/0/47637?amount=null
429,P48578,غرس الأشجار,"201,000ر.س",15/08/2024,"8,000",المواطنون والمقيمون بالمملكة,"22,296",جمعية البراري,تمير,https://ehsan.sa/projects/0/47580?amount=null
430,P48623,الفسحة المدرسية للطلاب والطالبات,"300,000ر.س",14/08/2024,600,المواطنون,"32,397",جمعية العون الخيرية,الطائف,https://ehsan.sa/projects/0/47624?amount=null
431,P48637,كفالة حفظة كتاب الله,"45,000ر.س",12/08/2024,15,المواطنون والمقيمون بالمملكة,"2,133",الجمعية الخيرية لتحفيظ القرآن الكريم في محافظة الطوال,الطوال,https://ehsan.sa/projects/0/47638?amount=null
432,P48630,تفريج كرب كبار السن,"148,800ر.س",12/08/2024,248,المواطنون,"11,106",جمعية إجلال للعناية بكبار السن بمركز الحكامية,الحكامية,https://ehsan.sa/projects/0/47631?amount=null
433,P48632,العمليات الجراحية للمتعففين,"150,000ر.س",12/08/2024,30,المواطنون والمقيمون بالمملكة,"6,618",ابتسامة الصحية,أبها,https://ehsan.sa/projects/0/47633?amount=null
434,P48611,السلال الغذائية للأسر المتعففة,"300,000ر.س",11/08/2024,87,المواطنون,"21,641",الجمعية الخيرية بمركز الحشرج,تربة,https://ehsan.sa/projects/0/47612?amount=null
435,P48608,دعم المقبلين على الزواج,"250,000ر.س",10/08/2024,50,المواطنون,"22,162",الجمعية الخيرية لمساعدة الشباب على الزواج والتوجيه الأسري بجدة,جدة,https://ehsan.sa/projects/0/47609?amount=null
436,P48609,رحلات العمرة للمتعففين,"100,000ر.س",09/08/2024,500,المواطنون والمقيمون بالمملكة,"9,226",ركين لإعانة الحاج والمعتمر,الخرج,https://ehsan.sa/projects/0/47610?amount=null
437,P48622,الزي المدرسي للطلاب المتعففين,"250,000ر.س",09/08/2024,500,المواطنون,"17,578",جمعية التنمية الأهلية بعياش,أبي عريش,https://ehsan.sa/projects/0/47623?amount=null
438,P48627,سقيا الماء لضيوف الرحمن,"280,000ر.س",09/08/2024,"500,000",المواطنون والمقيمون بالمملكة,"30,312",جمعية اليقظة النسائية الخيرية,مكة المكرمة,https://ehsan.sa/projects/0/47628?amount=null
439,P48621,دعم حلقات تحفيظ القرآن الكريم,"180,000ر.س",08/08/2024,25,المواطنون,"23,416",الجمعية الخيرية لتحفيظ القرآن الكريم بالمهد,المهد,https://ehsan.sa/projects/0/47622?amount=null
440,P48612,سقيا الماء لضيوف الرحمن,"500,000ر.س",08/08/2024,"250,000",المواطنون والمقيمون بالمملكة,"52,333",جمعية البر الخيرية بالليث,مكة المكرمة,https://ehsan.sa/projects/0/47613?amount=null
441,P48597,ترميم مساكن الأسر المتعففة,"200,000ر.س",08/08/2024,20,المواطنون والمقيمون بالمملكة,"13,931",جميعة تنمية جازان,جازان,https://ehsan.sa/projects/0/47598?amount=null
442,P48615,المستلزمات المدرسية للطلاب المتعففين,"90,000ر.س",07/08/2024,200,المواطنون,"8,084",جمعية خبرات التعليمية بمركز الحكامية,الحكامية,https://ehsan.sa/projects/0/47620?amount=null
443,P48620,تفريج كرب الأسر المتعففة,"300,000ر.س",07/08/2024,200,المواطنون,"22,615",جمعية البر والخدمات الاجتماعية بينبع النخل,ينبع النخيل,https://ehsan.sa/projects/0/47621?amount=null
444,P48613,كفالة حلقات تحفيظ القرآن الكريم,"150,000ر.س",06/08/2024,50,المواطنون والمقيمون بالمملكة,"12,745",الجمعية الخيرية لتحفيظ القرآن الكريم بمحافظة بلقرن,بلقرن,https://ehsan.sa/projects/0/47614?amount=null
445,P48614,الحقيبة المدرسية للطلاب المتعففين,"85,500ر.س",05/08/2024,570,المواطنون,"6,766",جمعية البر الخيرية بوادي ليه,الطائف,https://ehsan.sa/projects/0/47615?amount=null
446,P48607,تفريج كرب الأسر المتعففة,"252,000ر.س",05/08/2024,84,المواطنون,"15,390",جمعية البر الخيرية بالخنقة,الخنقة,https://ehsan.sa/projects/0/47608?amount=null
447,P48605,كفالة الأرامل والمطلقات,"100,000ر.س",05/08/2024,10,المواطنون,412,جمعية البر الخيرية بجلاجل,جلاجل,https://ehsan.sa/projects/0/47606?amount=null
448,P48601,دعم الأسر المتعففة,"370,200ر.س",03/08/2024,141,المواطنون,"23,164",جمعية البر الخيرية بمركز الأحمر,الأحمر,https://ehsan.sa/projects/0/47602?amount=null
449,P48499,تمكين المطلقات والأرامل,"300,000ر.س",03/08/2024,50,المواطنون,"22,408",جمعية ماجد بن عبدالعزيز للتنمية الاجتماعية,جدة,https://ehsan.sa/projects/0/47500?amount=null
450,P48587,سداد إيجار منازل الأسر المتعففة,"300,000ر.س",03/08/2024,16,المواطنون,"17,214",جمعية الريان الخيرية بوادي جازان,الريان,https://ehsan.sa/projects/0/47588?amount=null
451,P48409,تمكين الأمهات ومربيات الأطفال,"500,500ر.س",02/08/2024,143,المواطنون والمقيمون بالمملكة,"40,786",جمعية رعاية الطفولة,الرياض,https://ehsan.sa/projects/0/47410?amount=null
452,P48515,إعانة طلاب المرحلة الجامعية,"400,000ر.س",02/08/2024,154,المواطنون,"39,399",جمعية القطيف الخيرية,القطيف,https://ehsan.sa/projects/0/47516?amount=null
453,P48603,سقيا الماء للمتعففين,"450,000ر.س",02/08/2024,"500,000",المواطنون والمقيمون بالمملكة,"33,808",جمعية جوار لشؤون الموتى بقلوة,قلوة,https://ehsan.sa/projects/0/47604?amount=null
454,P48598,السلال الغذائية للأسر المتعففة,"400,000ر.س",02/08/2024,"1,839",المواطنون والمقيمون بالمملكة,"26,245",جمعية فائض للمساعدات العينية بعنيزة,عنيزة,https://ehsan.sa/projects/0/47599?amount=null
455,P48581,دعم المقبلين على الزواج,"290,000ر.س",02/08/2024,29,المواطنون,"18,245",جمعية ابن باز للتنمية الأسرية,الرياض,https://ehsan.sa/projects/0/47582?amount=null
456,P48602,تفريج كرب الأسر المتعففة,"350,000ر.س",02/08/2024,112,المواطنون,"18,625",جمعية التيسير لموقوفي الخدمات,بيشة,https://ehsan.sa/projects/0/47603?amount=null
457,P48604,دعم حلقات تحفيظ القرآن الكريم,"247,500ر.س",02/08/2024,55,المواطنون,"21,660",الجمعية الخيرية لتحفيظ القرآن الكريم بالبدائع,البدائع,https://ehsan.sa/projects/0/47605?amount=null
458,P48594,إكرام الموتى,"150,000ر.س",02/08/2024,200,المواطنون والمقيمون بالمملكة,"10,251",جمعية اكرام الموتى بسراة عبيدة,سراة عبيدة,https://ehsan.sa/projects/0/47595?amount=null
459,P48592,تفريج كرب الأسر المتعففة,"150,000ر.س",01/08/2024,150,المواطنون,"5,985",جمعية البر الخيرية بالسويرقية,السويرقية,https://ehsan.sa/projects/0/47594?amount=null
460,P48599,سقيا الماء لضيوف الرحمن,"500,000ر.س",01/08/2024,"500,000",المواطنون والمقيمون بالمملكة,"41,205",جمعية البر الخيرية بالحوية,السيل الكبير,https://ehsan.sa/projects/0/47600?amount=null
461,P48595,التكفل بالعمرة للجاليات,"34,300ر.س",31/07/2024,98,المواطنون والمقيمون بالمملكة,"2,525",جمعية الدعوة والإرشاد وتوعية الجاليات بمحافظة القطيف,النابية,https://ehsan.sa/projects/0/47596?amount=null
462,P48596,جلسات كيماوي عاجلة لمريض متعفف,"31,304ر.س",30/07/2024,1,المقيمون بالمملكة,"1,649",جمعية الإحسان الطبية الخيرية,جازان,https://ehsan.sa/projects/0/47597?amount=null
463,P48589,ترميم مساكن الأسر المتعففة,"380,950ر.س",30/07/2024,13,المواطنون,"20,429",الجمعية الخيرية بخميس حرب,خميس حرب,https://ehsan.sa/projects/0/47590?amount=null
464,P48582,كفالة الأرامل والمطلقات,"234,000ر.س",30/07/2024,39,المواطنون,"14,885",جمعية البر الخيرية بالدليمية,الدليمية,https://ehsan.sa/projects/0/47583?amount=null
465,P48585,العمليات الجراحية لكبار السن,"250,000ر.س",29/07/2024,10,المواطنون والمقيمون بالمملكة,"17,725",الجمعية الصحية التطوعية في الزلفي,الزلفي,https://ehsan.sa/projects/0/47586?amount=null
466,P48590,السلال الغذائية للأسر المتعففة,"228,000ر.س",29/07/2024,76,المواطنون,"12,172",جمعية فيض العطاء,أملج,https://ehsan.sa/projects/0/47591?amount=null
467,P48588,تأثيث منازل المتعففين,"150,000ر.س",28/07/2024,15,المواطنون,"9,403",جمعية البر الخيرية بالشفية,بدر,https://ehsan.sa/projects/0/47589?amount=null
468,P48586,استبدال الصمام الأورطي لمريض متعفف,"72,000ر.س",28/07/2024,1,المواطنون والمقيمون بالمملكة,"4,320",جمعية الإحسان الطبية الخيرية,جازان,https://ehsan.sa/projects/0/47587?amount=null
469,P48583,رعاية كبار السن المكفوفين,"216,000ر.س",28/07/2024,18,المواطنون,"15,269",جمعية الثريا للمكفوفين,جازان,https://ehsan.sa/projects/0/47584?amount=null
470,P48580,تفريج كرب المتعففين,"30,000ر.س",27/07/2024,10,المواطنون,"2,210",الجمعية الأهلية للزواج والتنمية الأسرية بالبكيرية,البكيرية,https://ehsan.sa/projects/0/47581?amount=null
471,P48573,رحلات العمرة للمتعففين,"260,925ر.س",27/07/2024,735,المواطنون والمقيمون بالمملكة,"24,005",جمعية الدعوة والإرشاد وتوعية الجاليات بشرورة,شرورة,https://ehsan.sa/projects/0/47574?amount=null
472,P48591,سقيا الماء للأسر المتعففة,"150,000ر.س",27/07/2024,500,المواطنون,"12,524",جمعية التنمية الأهلية بمركز القوبا,بيشة,https://ehsan.sa/projects/0/47592?amount=null
473,P48546,كسوة الأسر المتعففة,"200,000ر.س",26/07/2024,80,المواطنون,"16,732",جمعية التنمية الأهلية بمزهرة,الحكامية,https://ehsan.sa/projects/0/47547?amount=null
474,P48493,ترميم مساكن الأسر المتعففة,"219,000ر.س",26/07/2024,25,المواطنون,"13,586",جمعية مساكن,عنيزة,https://ehsan.sa/projects/0/47494?amount=null
475,P48538,تأثيث منازل المتعففين,"280,000ر.س",26/07/2024,14,المواطنون,"27,507",الجمعية الخيرية بوادي قديد,خليص,https://ehsan.sa/projects/0/47539?amount=null
476,P48568,تفريج كرب الأسر المتعففة,"300,000ر.س",26/07/2024,60,المواطنون,"20,308",جمعية البر الخيرية بعجلان وضواحيها,القنفذه,https://ehsan.sa/projects/0/47569?amount=null
477,P48577,السلال الغذائية للأسر المتعففة,"385,320ر.س",26/07/2024,741,المواطنون,"29,326",جمعية البر الخيرية بمركز الصنيناء,موقق,https://ehsan.sa/projects/0/47578?amount=null
478,P48574,عمليات المياه البيضاء للمتعففين,"100,000ر.س",25/07/2024,22,المواطنون والمقيمون بالمملكة,"7,926",جمعية يبصرون للعيون بمكة المكرمة,مكة المكرمة,https://ehsan.sa/projects/0/47575?amount=null
479,P48572,رعاية كبار السن المتعففين,"334,500ر.س",25/07/2024,223,المواطنون,"23,805",جمعية البر الخيرية بوادي بني عمير صنائع,المضيق,https://ehsan.sa/projects/0/47573?amount=null
480,P48571,دعم المقبلين على الزواج,"135,000ر.س",25/07/2024,9,المواطنون,"11,626",جمعية البر الخيرية بالبجادية,البجادية,https://ehsan.sa/projects/0/47572?amount=null
481,P48570,دعم الأسر المتعففة,"122,000ر.س",24/07/2024,122,المواطنون,"8,696",جمعية البر الخيرية بالحيد,الحيد,https://ehsan.sa/projects/0/47571?amount=null
482,P48576,سداد إيجار منازل الأسر المتعففة,"234,000ر.س",24/07/2024,13,المواطنون,"18,192",جمعية البر الخيرية بالحرجة,الحرجة,https://ehsan.sa/projects/0/47577?amount=null
483,P48575,الأجهزة الطبية لذوي الإعاقة,"41,500ر.س",23/07/2024,200,المواطنون,"2,603",جمعية قادرون للأشخاص ذوي الإعاقة بمحافظة شقراء,شقراء,https://ehsan.sa/projects/0/47576?amount=null
484,P48564,سقيا الماء للمتعففين,"301,500ر.س",22/07/2024,603,المواطنون,"28,531",جمعية البر الخيرية ببني حسن,بني حسن,https://ehsan.sa/projects/0/47568?amount=null
485,P48547,دعم الأسر المتضررة,"200,000ر.س",21/07/2024,50,المواطنون,"19,674",جمعية روافد الخيرية النسائية,العيص,https://ehsan.sa/projects/0/47551?amount=null
486,P48554,الأجهزة الطبية للمتعففين,"150,000ر.س",21/07/2024,60,المواطنون والمقيمون بالمملكة,"11,716",جمعية اسناد لرعاية الأشخاص ذوي الاعاقة,شرورة,https://ehsan.sa/projects/0/47555?amount=null
487,P48558,العمليات الجراحية لمرضى العيون,"300,000ر.س",21/07/2024,26,المواطنون والمقيمون بالمملكة,"24,681",جمعية سفانة الخيرية للخدمات الصحية بحائل,حائل,https://ehsan.sa/projects/0/47559?amount=null
488,P48463,الأجهزة الكهربائية للمتعففين,"387,600ر.س",20/07/2024,76,المواطنون,"37,631",جمعية البر الخيرية بالسرح,السرح,https://ehsan.sa/projects/0/47464?amount=null
489,P48559,سداد إيجارات الأسر المتعففة,"400,000ر.س",20/07/2024,80,المواطنون,"26,008",جمعية البر الخيرية بأبها,أبها,https://ehsan.sa/projects/0/47560?amount=null
490,P48561,السلال الغذائية للأسر المتعففة,"290,000ر.س",19/07/2024,"1,000",المواطنون,"22,836",جمعية البر الخيرية بالشرائع,مكة المكرمة,https://ehsan.sa/projects/0/47562?amount=null
491,P48557,دعم المقبلين على الزواج,"200,000ر.س",19/07/2024,29,المواطنون,"15,729",جمعية البر الخيرية بأبها,أبها,https://ehsan.sa/projects/0/47558?amount=null
492,P48555,سقيا الماء للمناطق النائية,"1,012,000ر.س",19/07/2024,"20,000",المواطنون والمقيمون بالمملكة,"76,711",الجمعية الخيرية لخدمات المياه الصالحة للشرب إرواء,ضليع رشيد,https://ehsan.sa/projects/0/47556?amount=null
493,P48562,حلقات تحفيظ القرآن لكبيرات السن,"97,500ر.س",18/07/2024,60,المواطنون,"11,355",الجمعية الخيرية لتحفيظ القرآن الكريم بتندحة,تندحة,https://ehsan.sa/projects/0/47563?amount=null
494,P48560,وجبات الطعام للأسر المتعففة,"250,000ر.س",18/07/2024,"40,000",المواطنون والمقيمون بالمملكة,"21,085",جمعية أرزاق لحفظ النعمة,الطائف,https://ehsan.sa/projects/0/47561?amount=null
495,P48553,رعاية كبار السن المتعففين,"150,000ر.س",18/07/2024,25,المواطنون,"6,443",جمعية البر الخيرية بمركز حسوة,حسوة,https://ehsan.sa/projects/0/47554?amount=null
496,P48543,دعم حلقات تحفيظ القرآن الكريم,"189,000ر.س",17/07/2024,126,المواطنون,"18,931",الجمعية الخيرية لتحفيظ القرآن الكريم بالعظيم,العظيم,https://ehsan.sa/projects/0/47544?amount=null
497,P48556,السلال الغذائية للمتعففين,"167,000ر.س",16/07/2024,334,المواطنون,"13,820",جمعية لين للأعمال الإنسانية,البجيدي,https://ehsan.sa/projects/0/47557?amount=null
498,P48552,دعم المقبلين على الزواج,"90,000ر.س",16/07/2024,9,المواطنون,"7,569",جمعية زواج الخيرية ورعاية الاسرة بالباحة فرح,الباحة,https://ehsan.sa/projects/0/47553?amount=null
499,P48517,عمليات استبدال المفاصل للمتعففين,"500,000ر.س",16/07/2024,10,المواطنون,"29,533",الجمعية الخيرية لعلاج المرضى في منطقة الرياض علاجي,الرياض,https://ehsan.sa/projects/0/47518?amount=null
500,P48551,تفريج كرب المتعففين,"340,000ر.س",16/07/2024,685,المواطنون,"27,147",جمعية العوامية الخيرية للخدمات الاجتماعية,العوامية,https://ehsan.sa/projects/0/47552?amount=null
501,P48542,سقيا الماء للمناطق النائية,"1,042,000ر.س",14/07/2024,"8,000",المواطنون والمقيمون بالمملكة,"73,839",الجمعية الخيرية لخدمات المياه الصالحة للشرب إرواء,العفيرية,https://ehsan.sa/projects/0/47543?amount=null
502,P48540,كفالة أسر المدمنين,"200,000ر.س",14/07/2024,250,المواطنون,"14,864",جمعية التأهيل المستمر بالطائف,الطائف,https://ehsan.sa/projects/0/47541?amount=null
503,P48537,سداد إيجار منازل الأسر المتعففة,"135,000ر.س",14/07/2024,15,المواطنون,"8,401",جمعية البر الخيرية ببريدة,بريدة,https://ehsan.sa/projects/0/47538?amount=null
504,P48147,ترميم منازل المتعففين,"2,294,000ر.س",13/07/2024,37,المقيمون بالمملكة,"147,007",جمعية مقر للإسكان التنموي,القنفذه,https://ehsan.sa/projects/0/47148?amount=null
505,P48536,تموين الأسر المتعففة,"200,000ر.س",12/07/2024,100,المواطنون,"13,670",جمعية أصدقاء لاعبي كرة القدم الخيرية,الرياض,https://ehsan.sa/projects/0/47537?amount=null
506,P48541,السماعات الطبية لضعاف السمع,"14,000ر.س",12/07/2024,7,المواطنون والمقيمون بالمملكة,"1,067",جمعية تعاطف الخيرية بمنطقة الباحة,الباحة,https://ehsan.sa/projects/0/47542?amount=null
