,Case Number,Project Names,Amount,Date,Beneficiaries,Beneficiary type,Number of donations,Partner,Location,Details URL
705,P48288,توفير اللحوم للأسر المتعففة,"192,000ر.س",24/05/2024,120,المواطنون,"13,301",جمعية البر الخيرية بمغينية,رابغ,https://ehsan.sa/projects/0/47289?amount=null
706,P48306,كفالة الحُجّاج,"396,337ر.س",24/05/2024,39,المواطنون والمقيمون بالمملكة,"25,249",جمعية حفاوة لخدمة الحاج والمعتمر والزائر,مكة المكرمة,https://ehsan.sa/projects/0/47307?amount=null
707,P48272,سداد إيجار منازل الأسر المتعففة,"247,000ر.س",24/05/2024,19,المواطنون والمقيمون بالمملكة,"14,725",جمعية الحلول التنموية للإسكان,الحليله,https://ehsan.sa/projects/0/47273?amount=null
708,P48225,زراعة الأشجار لمكافحة التصحر,"155,000ر.س",23/05/2024,"30,000",المواطنون والمقيمون بالمملكة,"18,075",جمعية التنمية الأهلية بالجنينة,بيشة,https://ehsan.sa/projects/0/47226?amount=null
709,P48270,ترجمة معاني القرآن الكريم إلى الألمانية,"120,000ر.س",23/05/2024,"3,000",المواطنون والمقيمون بالمملكة,"10,738",مجمع الملك فهد لطباعة المصحف الشريف بالمدينة المنورة,المدينة المنورة,https://ehsan.sa/projects/0/47271?amount=null
710,P48305,سقيا الماء,"546,000ر.س",23/05/2024,350,المواطنون,"53,397",جمعية البر الخيرية بالغريف,الكامل,https://ehsan.sa/projects/0/47306?amount=null
711,P48289,تأمين أجهزة القوقعة للمتعففين,"220,000ر.س",22/05/2024,4,المواطنون,"12,062",الجمعية الصحية التطوعية في الزلفي,الزلفي,https://ehsan.sa/projects/0/47290?amount=null
712,P48295,كفالة أمهات الأيتام,"182,400ر.س",21/05/2024,38,المواطنون,"8,737",جمعية عثمان بن عفان الخيرية بالحفائر,خميس  مشيط,https://ehsan.sa/projects/0/47296?amount=null
713,P48302,كفالة الحُجّاج,"279,774ر.س",20/05/2024,54,المواطنون والمقيمون بالمملكة,"19,696",جمعية الدعوة والارشاد وتوعية الجاليات في مركز البجادية,البجادية,https://ehsan.sa/projects/0/47303?amount=null
714,P48263,الرعاية الصحية لمرضى الفشل الكلوي,"399,400ر.س",20/05/2024,50,المواطنون والمقيمون بالمملكة,"19,923",جمعية أطباء طيبة الطبية الخيرية حياة,المدينة المنورة,https://ehsan.sa/projects/0/47264?amount=null
715,P48293,إعانة أسر السجناء,"80,000ر.س",20/05/2024,5,المواطنون والمقيمون بالمملكة,"5,244",جمعية مساعدة السجناء المعسرين والمعوزين بجدة,جدة,https://ehsan.sa/projects/0/47294?amount=null
716,P48292,تفريج كرب المتعففين,"260,000ر.س",19/05/2024,130,المواطنون,"17,563",جمعية عثمان بن عفان الخيرية بالحفائر,خميس  مشيط,https://ehsan.sa/projects/0/47293?amount=null
717,P48296,رعاية كبار السن المتعففين,"180,000ر.س",19/05/2024,120,المواطنون,"15,706",جمعية البر الخيرية بالهمجة,النبهانية,https://ehsan.sa/projects/0/47297?amount=null
718,P48301,سقيا الماء لضيوف الرحمن,"600,000ر.س",19/05/2024,"1,090,909",المواطنون والمقيمون بالمملكة,"49,686",جمعية رفادة لخدمة الحاج والمعتمر,مكة المكرمة,https://ehsan.sa/projects/0/47302?amount=null
719,P48297,كفالة الحجاج,"399,900ر.س",18/05/2024,43,المواطنون,"21,842",جمعية البر الخيرية للخدمات الاجتماعية بمحافظة يدمة,يدمة,https://ehsan.sa/projects/0/47298?amount=null
720,P48275,دعم حلقات تحفيظ القرآن الكريم,"300,000ر.س",17/05/2024,309,المواطنون والمقيمون بالمملكة,"25,637",جمعية تحفيظ القرآن الكريم بالرياض مكنون,الرياض,https://ehsan.sa/projects/0/47276?amount=null
721,P48291,وجبات الطعام للأسر المتعففة,"92,400ر.س",17/05/2024,"4,620",المواطنون والمقيمون بالمملكة,"6,946",جمعية حفظ النعمة الخيرية بالبدائع,البدائع,https://ehsan.sa/projects/0/47292?amount=null
722,P48284,سقيا الماء للأسر المتعففة,"541,800ر.س",17/05/2024,"1,204",المواطنون,"51,625",جمعية البر الخيرية بمركز غميقة,الليث,https://ehsan.sa/projects/0/47285?amount=null
723,P48283,كفالة الحجاج,"632,500ر.س",17/05/2024,55,المواطنون والمقيمون بالمملكة,"42,945",جمعية سعادتي الاجتماعية,الرياض,https://ehsan.sa/projects/0/47284?amount=null
724,P48255,السلال الغذائية للأسر المحتاجة,"268,500ر.س",16/05/2024,537,المواطنون,"18,325",جمعية البر الخيرية بربوع العين,أضم,https://ehsan.sa/projects/0/47256?amount=null
725,P48267,تفريج كرب الأسر المتعففة,"100,000ر.س",15/05/2024,20,المواطنون,"6,923",جمعية أصدقاء لاعبي كرة القدم الخيرية,الرياض,https://ehsan.sa/projects/0/47268?amount=null
726,P48276,وجبات الطعام للأسر المتعففة,"220,000ر.س",15/05/2024,"44,000",المواطنون والمقيمون بالمملكة,"17,255",جمعية خيرات لحفظ النعمة,الرياض,https://ehsan.sa/projects/0/47283?amount=null
727,P48269,التكفل بالعمرة للمتعففين,"45,000ر.س",14/05/2024,150,المواطنون والمقيمون بالمملكة,"3,904",جمعية الدعوة والإرشاد بقرى الحسيني والنجوع,صبياء,https://ehsan.sa/projects/0/47270?amount=null
728,P48256,دعم المقبلين على الزواج,"250,000ر.س",14/05/2024,50,المواطنون,"18,554",الجمعية الخيرية لمساعدة الشباب على الزواج والتوجيه الأسري بجدة,جدة,https://ehsan.sa/projects/0/47257?amount=null
729,P48273,سقيا الماء,"500,000ر.س",13/05/2024,"500,000",المواطنون والمقيمون بالمملكة,"48,066",جمعية الغريف بمحافظة الخرمة,النزهة - مكة المكرمة,https://ehsan.sa/projects/0/47274?amount=null
730,P48244,الأجهزة الطبية للمتعففين,"150,000ر.س",13/05/2024,67,المواطنون والمقيمون بالمملكة,"9,023",اكرام المسنين بمنطقة مكة المكرمة,جدة,https://ehsan.sa/projects/0/47245?amount=null
731,P48274,الكفالة التعليمية للطلاب المتعففين,"36,000ر.س",13/05/2024,25,المواطنون,"1,746",جمعية التنمية الاهلية بالعماير,الأمواه,https://ehsan.sa/projects/0/47275?amount=null
732,P48271,عملية جراحية لمريض هشاشة عظام,"26,400ر.س",12/05/2024,1,المقيمون بالمملكة,"1,632",جمعية رحماء الصحية,الرياض,https://ehsan.sa/projects/0/47272?amount=null
733,P48242,رعاية كبار السن المتعففين,"268,000ر.س",12/05/2024,67,المواطنون,"18,060",جمعية أكابر لكبار السن بمنطقة عسير,أبها,https://ehsan.sa/projects/0/47243?amount=null
734,P47907,توفير الأجهزة الكهربائية للمحتاجين,"199,992ر.س",12/05/2024,39,المواطنون,"17,753",جمعية مساند لتمكين ذوي الظروف الخاصة بمكة المكرمة,مكة المكرمة,https://ehsan.sa/projects/0/46908?amount=null
735,P48261,كفالة رواتب معلمي ومعلمات حلقات تحفيظ القرآن الكريم,"200,000ر.س",11/05/2024,100,المواطنون,"19,107",الجمعية تحفيظ القرآن الكريم بالجموم,الجموم,https://ehsan.sa/projects/0/47262?amount=null
736,P48266,تيسير نقل المرضى المتعففين,"156,000ر.س",11/05/2024,8,المواطنون والمقيمون بالمملكة,"16,640",جمعية الخدمات الطبية الاسعافية,الرياض,https://ehsan.sa/projects/0/47267?amount=null
737,P48265,سداد إيجار منازل الأسر المتعففة,"336,400ر.س",11/05/2024,102,المواطنون والمقيمون بالمملكة,"21,314",جمعية الإحسان للخدمات الاجتماعية,بريدة,https://ehsan.sa/projects/0/47266?amount=null
738,P48257,كفالة الأرامل والمطلقات,"250,000ر.س",11/05/2024,50,المواطنون,"17,158",جمعية عطاء بمحافظة جده,جدة,https://ehsan.sa/projects/0/47258?amount=null
739,P48246,جلسات العلاج التأهيلي للمتعففين,"300,000ر.س",10/05/2024,24,المواطنون والمقيمون بالمملكة,"22,592",جمعية إيفاء لرعاية ذوي الإعاقة,الدمام,https://ehsan.sa/projects/0/47247?amount=null
740,P48245,توفير الإنسولين لمرضى السكري,"300,000ر.س",10/05/2024,200,المواطنون والمقيمون بالمملكة,"20,538",جمعية اصدقاء مرضى السكر الخيرية,جدة,https://ehsan.sa/projects/0/47246?amount=null
741,P48203,وجبات الطعام للطلاب الجامعيين,"195,000ر.س",10/05/2024,"15,000",المقيمون بالمملكة,"19,286",جمعية ارزاق الخير لحفظ النعمة,حفر الباطن,https://ehsan.sa/projects/0/47204?amount=null
742,P48264,كفالة مغسلي الجنائز,"74,400ر.س",10/05/2024,3,المواطنون والمقيمون بالمملكة,"6,921",جمعية الإحسان لشؤون الموتى بمحافظة وادي الدواسر,وادى الدواسر,https://ehsan.sa/projects/0/47265?amount=null
743,P48252,سقيا الماء للأسر المتعففة,"300,000ر.س",10/05/2024,810,المواطنون,"27,264",جمعية التنمية الأهلية بالشداخة,بيشة,https://ehsan.sa/projects/0/47253?amount=null
744,P48262,جلسات كيماوي عاجلة لمريضة متعففة,"43,813ر.س",09/05/2024,1,المواطنون والمقيمون بالمملكة,"2,456",جمعية الإحسان الطبية الخيرية,جازان,https://ehsan.sa/projects/0/47263?amount=null
745,P48258,رحلات العمرة للمتعففين,"99,000ر.س",09/05/2024,800,المواطنون والمقيمون بالمملكة,"9,857",جمعية الدعوة والإرشاد وتوعية الجاليات بالمحاني,الطائف,https://ehsan.sa/projects/0/47259?amount=null
746,P48259,ترجمة معاني القرآن الكريم إلى الكورية,"76,000ر.س",09/05/2024,"1,000",المواطنون والمقيمون بالمملكة,"7,862",مجمع الملك فهد لطباعة المصحف الشريف بالمدينة المنورة,المدينة المنورة,https://ehsan.sa/projects/0/47260?amount=null
747,P48254,تفريج كرب الأسر المتعففة,"270,000ر.س",08/05/2024,108,المواطنون,"15,656",جمعية البر الخيرية بمحافظة قرية العليا,قرية العليا,https://ehsan.sa/projects/0/47255?amount=null
748,P48260,عملية جراحية لمصابة بكسر في الترقوة,"23,920ر.س",07/05/2024,1,المقيمون بالمملكة,"1,695",جمعية رحماء الصحية,الرياض,https://ehsan.sa/projects/0/47261?amount=null
749,P48231,سداد إيجار الأسر المتعففة,"300,000ر.س",07/05/2024,25,المواطنون,"13,278",جمعية البر الخيرية بثلوث المنظر,ثلوث المنظر,https://ehsan.sa/projects/0/47232?amount=null
750,P48233,السلال الغذائية للأسر المحتاجة,"213,500ر.س",06/05/2024,610,المواطنون,"14,151",جمعية البر الخيرية بمركز فيضة اثقب,حائل,https://ehsan.sa/projects/0/47234?amount=null
751,P48237,التكفل بالعمرة للمعاقين من الجاليات,"250,000ر.س",06/05/2024,50,المقيمون بالمملكة,"21,006",جمعية حفاوة لخدمة الحاج والمعتمر والزائر,مكة المكرمة,https://ehsan.sa/projects/0/47238?amount=null
752,P48241,كفالة الأرامل والمطلقات,"78,000ر.س",05/05/2024,48,المواطنون,"4,391",جمعية مركز الحماده,فيضة الحماده,https://ehsan.sa/projects/0/47242?amount=null
753,P48243,طباعة المصحف الشريف باللغة التركية,"100,000ر.س",05/05/2024,"4,000",المواطنون والمقيمون بالمملكة,"10,030",مجمع الملك فهد لطباعة المصحف الشريف بالمدينة المنورة,المدينة المنورة,https://ehsan.sa/projects/0/47244?amount=null
754,P47826,الكفالة التعليمية للطلاب المحتاجين,"200,000ر.س",05/05/2024,100,المواطنون,"17,437",جمعية فتاة الاحساء التنموية الخيرية,الأحساء,https://ehsan.sa/projects/0/46827?amount=null
755,P48240,دعم المقبلين على الزواج,"160,000ر.س",04/05/2024,16,المواطنون,"7,790",جمعية التنمية الأسرية في محافظة الأفلاج,الأفلاج,https://ehsan.sa/projects/0/47241?amount=null
756,P48248,سقيا الماء لضيوف الرحمن,"500,000ر.س",04/05/2024,"500,000",المواطنون والمقيمون بالمملكة,"43,081",الجمعية الخيرية بمحافظة الكامل,مكة المكرمة,https://ehsan.sa/projects/0/47249?amount=null
757,P48239,تأثيث منازل المتعففين,"250,000ر.س",04/05/2024,79,المواطنون,"21,066",جمعية البر الخيرية بأم الدوم,المويه,https://ehsan.sa/projects/0/47240?amount=null
758,P48247,علاج تأخر النمو لطفلة,"30,000ر.س",03/05/2024,1,المقيمون بالمملكة,"1,579",جمعية الكوثر الصحية بعسير,أبها,https://ehsan.sa/projects/0/47248?amount=null
759,P48235,تفريج كرب الأسر المتعففة,"301,500ر.س",03/05/2024,201,المواطنون,"16,844",جمعية البر الخيرية بمركز شثاث,الشبحة,https://ehsan.sa/projects/0/47236?amount=null
760,P48236,كفالة الأرامل والمطلقات,"246,000ر.س",03/05/2024,41,المواطنون,"12,976",جمعية البر الخيرية بمركز غامد الزناد بمنطقة الباحة,غامد الزناد,https://ehsan.sa/projects/0/47237?amount=null
761,P48238,طباعة المصاحف,"400,000ر.س",03/05/2024,"10,000",المواطنون والمقيمون بالمملكة,"34,791",مجمع الملك فهد لطباعة المصحف الشريف بالمدينة المنورة,المدينة المنورة,https://ehsan.sa/projects/0/47239?amount=null
762,P48232,علاج حرق من الدرجة الثالثة لمريض متعفف,"84,223ر.س",02/05/2024,1,المقيمون بالمملكة,"4,030",جمعية رحماء الصحية,الرياض,https://ehsan.sa/projects/0/47233?amount=null
763,P47831,الأجهزة الطبية للمتعففين,"100,000ر.س",02/05/2024,50,المواطنون والمقيمون بالمملكة,"5,027",جمعية بسمة معافى الصحية,حفر الباطن,https://ehsan.sa/projects/0/46832?amount=null
764,P48234,سقيا الماء,"246,000ر.س",01/05/2024,205,المواطنون,"16,567",جمعية البر والخدمات الاجتماعية بأرن,ارن,https://ehsan.sa/projects/0/47235?amount=null
765,P47624,الكفالة التعليمية للأيتام,"10,010ر.س",30/04/2024,7,المواطنون,527,الجمعية الخيرية لرعاية الايتام بتبوك,تبوك,https://ehsan.sa/projects/0/46625?amount=null
766,P48222,كفالة الأرامل المتعففات,"398,400ر.س",30/04/2024,166,المواطنون,"19,575",الجمعية الخيرية لرعاية الأيتام بالمنطقة الشرقية بناء,الخبر,https://ehsan.sa/projects/0/47225?amount=null
767,P48213,استكمال بناء مسجد جازان,"2,405,322ر.س",30/04/2024,300,المواطنون والمقيمون بالمملكة,"150,783",جمعية كفاءة للتشغيل والصيانة الأهلية,بلغازي,https://ehsan.sa/projects/0/47214?amount=null
768,P47855,توفير الأجهزة الكهربائية للمحتاجين,"195,000ر.س",30/04/2024,195,المواطنون,"19,611",جمعية الملك خالد الخيرية النسائية بتبوك,تبوك,https://ehsan.sa/projects/0/46856?amount=null
769,P48228,العلاج الكيميائي للأطفال المصابين بالسرطان,"499,062ر.س",30/04/2024,4,المقيمون بالمملكة,"23,112",بصمة تفاؤل لمرضى سرطان الاطفال,الرياض,https://ehsan.sa/projects/0/47229?amount=null
770,P48227,الجلسات التأهيلية لذوي الإعاقة,"300,000ر.س",29/04/2024,20,المواطنون,"20,474",جمعية التوحد في محافظة رجال ألمع,رجال ألمع,https://ehsan.sa/projects/0/47228?amount=null
771,P47823,الكفالة التعليمية للطلاب المحتاجين,"177,120ر.س",29/04/2024,123,المواطنون,"13,712",جمعية البر الخيرية بالأبواء,الأبواء,https://ehsan.sa/projects/0/46824?amount=null
772,P48200,تأثيث مساكن اليتيمات,"494,400ر.س",29/04/2024,12,المواطنون,"37,398",جمعية بنيان للخدمات الاجتماعية,بريدة,https://ehsan.sa/projects/0/47201?amount=null
773,P48221,السلال الغذائية للأسر المحتاجة,"158,400ر.س",28/04/2024,198,المواطنون والمقيمون بالمملكة,"9,816",جمعية البر بمركز سلطانة,سلطانة,https://ehsan.sa/projects/0/47222?amount=null
774,P48215,دعم المقبلين على الزواج,"450,000ر.س",27/04/2024,90,المواطنون,"31,091",جمعية التنمية الأسرية بالمنطقة الشرقية وئام,الدمام,https://ehsan.sa/projects/0/47216?amount=null
775,P48230,توفير المصاحف للمكفوفين,"280,000ر.س",27/04/2024,35,المواطنون,"22,624",جمعية المكفوفين الأهلية بمنطقة الرياض كفيف,الرياض,https://ehsan.sa/projects/0/47231?amount=null
776,P48217,رعاية كبار السن المتعففين,"180,000ر.س",26/04/2024,30,المواطنون,"9,637",الجمعية السعودية لمساندة كبار السن وقار,الرياض,https://ehsan.sa/projects/0/47218?amount=null
777,P48226,التكفل بالعمرة للمتعففين,"40,000ر.س",26/04/2024,67,المواطنون,"3,434",الجمعية النسائية بحفر الباطن (درة),حفر الباطن,https://ehsan.sa/projects/0/47227?amount=null
778,P48204,سداد إيجار منازل الأسر المتعففة,"400,600ر.س",26/04/2024,14,المواطنون,"23,936",جمعية أصدقاء لاعبي كرة القدم الخيرية,الرياض,https://ehsan.sa/projects/0/47205?amount=null
779,P47873,سقيا الماء,"102,000ر.س",26/04/2024,680,المواطنون والمقيمون بالمملكة,"8,625",جمعية الشماس للخدمات الاجتماعية عطاء ببريده,بريدة,https://ehsan.sa/projects/0/46874?amount=null
780,P48229,الفحوصات الطبية لمريضة مصابة بورم في الثدي,"51,051ر.س",25/04/2024,1,المقيمون بالمملكة,"2,903",جمعية رحماء الصحية,الرياض,https://ehsan.sa/projects/0/47230?amount=null
781,P47828,الأجهزة الطبية للمتعففين,"60,000ر.س",25/04/2024,60,المواطنون والمقيمون بالمملكة,"4,151",جمعية مراس الصحية,أبها,https://ehsan.sa/projects/0/46829?amount=null
782,P47833,توفير الأدوية للمرضى المحتاجين,"127,500ر.س",25/04/2024,50,المقيمون بالمملكة,"8,592",جمعية رحماء الصحية,الرياض,https://ehsan.sa/projects/0/46834?amount=null
783,P48220,كفالة الأرامل والمطلقات,"184,000ر.س",25/04/2024,184,المواطنون,"9,890",جمعية البر والخدمات الاجتماعية بسبت العلاية,بلقرن,https://ehsan.sa/projects/0/47221?amount=null
784,P48150,طباعة ونشر المصاحف,"2,250,000ر.س",25/04/2024,"150,000",المواطنون والمقيمون بالمملكة,"149,597",مجمع الملك فهد لطباعة المصحف الشريف بالمدينة المنورة,المدينة المنورة,https://ehsan.sa/projects/0/47155?amount=null
785,P48216,رحلات العمرة للمتعففين,"100,000ر.س",25/04/2024,200,المواطنون والمقيمون بالمملكة,"10,470",جمعية الدعوة والإرشاد وتوعية الجاليات ببني حسن,بني حسن,https://ehsan.sa/projects/0/47217?amount=null
786,P47866,سقيا الماء للأسر المتعففة,"50,000ر.س",24/04/2024,100,المواطنون,"4,562",جمعية التنمية الاجتماعية بالغالة,الغالة,https://ehsan.sa/projects/0/46867?amount=null
787,P47821,الكفالة التعليمية للطلاب,"172,800ر.س",24/04/2024,120,المواطنون,"11,112",جمعية أيتام الجبيل,الجبيل,https://ehsan.sa/projects/0/46822?amount=null
788,P47836,الرعاية الصحية لمرضى السرطان,"170,000ر.س",24/04/2024,17,المقيمون بالمملكة,"7,209",جمعية براءة لأمراض دم وسرطان الاطفال بمكة,مكة المكرمة,https://ehsan.sa/projects/0/46837?amount=null
789,P48219,السلال الغذائية للأسر المحتاجة,"161,000ر.س",24/04/2024,322,المواطنون,"12,110",جمعية البر الخيرية بالحفير,الحفير,https://ehsan.sa/projects/0/47220?amount=null
790,P47847,سقيا الماء,"33,600ر.س",23/04/2024,"1,200",المواطنون,"2,405",جمعية البر الخيرية بالحقو,الحقو,https://ehsan.sa/projects/0/46848?amount=null
791,P47920,كفالة الأرامل والمطلقات,"202,500ر.س",23/04/2024,75,المواطنون,"10,376",جمعية البر الخيرية بمركز شثاث,الشبحة,https://ehsan.sa/projects/0/46921?amount=null
792,P48163,الأجهزة الطبية للمحتاجين,"210,000ر.س",23/04/2024,42,المقيمون بالمملكة,"12,477",جمعية الرعاية الصحية بعقلة الصقور,عقلة الصقور,https://ehsan.sa/projects/0/47164?amount=null
793,P47876,سقيا الماء,"103,500ر.س",23/04/2024,250,المواطنون والمقيمون بالمملكة,"9,614",جمعية البر الخيرية بالغالة,الغالة,https://ehsan.sa/projects/0/46877?amount=null
794,P48170,دعم معلمي ومعلمات حلقات التحفيظ,"300,000ر.س",22/04/2024,200,المواطنون,"20,811",الجمعية الخيرية لتحفيظ القرآن الكريم بمكة المكرمة,مكة المكرمة,https://ehsan.sa/projects/0/47171?amount=null
795,P47928,تفريج كرب الأسر المحتاجة,"375,000ر.س",22/04/2024,250,المواطنون,"28,040",جمعية البر الخيرية بتهامة بللسمر وبللحمر,تهامة باللحمر وباللسمر,https://ehsan.sa/projects/0/46929?amount=null
796,P48214,السلال الغذائية للأسر المتعففة,"200,233ر.س",22/04/2024,"1,199",المواطنون,"11,589",جمعية البر الأهلية بيشة,بيشة,https://ehsan.sa/projects/0/47215?amount=null
797,P47825,الأجهزة الطبية لذوي الإعاقة,"50,000ر.س",22/04/2024,100,المواطنون,"2,207",جمعية قادرون للأشخاص ذوي الإعاقة بمحافظة شقراء,شقراء,https://ehsan.sa/projects/0/46826?amount=null
798,P48218,جلسات العلاج باليود لمريضة متعففة,"64,400ر.س",21/04/2024,1,المقيمون بالمملكة,"3,465",جمعية رحماء الصحية,الرياض,https://ehsan.sa/projects/0/47219?amount=null
799,P47846,سقيا الماء,"12,420ر.س",21/04/2024,276,المواطنون والمقيمون بالمملكة,"1,220",جمعية الداهنة الخيرية,الداهنة,https://ehsan.sa/projects/0/46847?amount=null
800,P47988,سقيا الماء للأسر المتعففة,"140,000ر.س",21/04/2024,70,المواطنون والمقيمون بالمملكة,"15,783",نبع الخير,تربة,https://ehsan.sa/projects/0/46989?amount=null
801,P48161,رعاية وتأهيل أطفال اضطرابات النطق والتخاطب,"196,759ر.س",21/04/2024,41,المواطنون والمقيمون بالمملكة,"8,776",جمعية ناطق للنطق والتخاطب,أبها,https://ehsan.sa/projects/0/47162?amount=null
802,P48196,سقيا الماء للمعتمرين,"600,000ر.س",19/04/2024,"600,000",المواطنون والمقيمون بالمملكة,"64,116",جمعية البر الخيرية بثول,مكة المكرمة,https://ehsan.sa/projects/0/47199?amount=null
803,P48201,السلال الغذائية للأسر المحتاجة,"200,000ر.س",19/04/2024,200,المواطنون,"11,442",الجمعية الأهلية لحفظ النعمة بالأفلاج,الأفلاج,https://ehsan.sa/projects/0/47202?amount=null
804,P47927,تفريج كربة,"300,000ر.س",19/04/2024,60,المواطنون,"19,711",الجمعية السعودية الخيرية للفصام ( احتواء),الرياض,https://ehsan.sa/projects/0/46928?amount=null
